text,intent
Kann ich die Fernsehshow Earth Defense Force 2025 finden?,SearchCreativeWork
Suchen Sie nach der kreativen Arbeit called White Sugar,SearchCreativeWork
Finden Sie mir das Buch called Suffer,SearchCreativeWork
"Kannst du mir helfen, den Author zu finden?",SearchCreativeWork
Finden Sie die Abbildung Vertically Challenged,SearchCreativeWork
Was ist das Buch Sell Your Body?,SearchCreativeWork
Ich möchte den Novel Called Innocent Until Caught 2: Schuldig,SearchCreativeWork
Where kann ich das Painting von Without Condition finden,SearchCreativeWork
"Wer war der Künstler, der den painting called Spyro 2: Season of Flame getötet hat?",SearchCreativeWork
Ich würde gerne zu Spyforce gehen.,SearchCreativeWork
Are there any painting des 1. Konzert Oh Yeah! 1999?,SearchCreativeWork
where can I find the video game called Izuna 2: The Unemployed Ninja Returns,SearchCreativeWork
Where kann ich die painting RSS-Tracking finden,SearchCreativeWork
Zeig mir den Herzspezialisten,SearchCreativeWork
Find ein TV series called Die Goldenen Hits von Sandie Shaw.,SearchCreativeWork
find ein movie called Emerald Stadt,SearchCreativeWork
Finden Sie das Trailer für Hotel auf der Corner von Bitter und Sweet,SearchCreativeWork
Creativität von novel Lock zeigen,SearchCreativeWork
Find Black Mirror III: Schlussfee,SearchCreativeWork
Creativität von Home Brew zeigen,SearchCreativeWork
Suchen Sie eine television show called Tiny Dancer,SearchCreativeWork
Findet einen painting called Thunder im Himmel.,SearchCreativeWork
"Findet ein Spiel, das einen Luft-Freude-Ride",SearchCreativeWork
find Liebende für mich,SearchCreativeWork
Find Das Internationale Journal der Robotik Forschung soundtrack,SearchCreativeWork
creative Arbeitsnotizen zeigen,SearchCreativeWork
Please look up die Schönheit in der Feuershow.,SearchCreativeWork
Please find me Glass Cloud – Single.,SearchCreativeWork
Ich wollte den Verräter für die Entität sehen.,SearchCreativeWork
Was ist die TV-Show Journal of Personality and Social Psychology?,SearchCreativeWork
Where kann ich die Novel Flesh-Colored,SearchCreativeWork
"find Terminator 3: Die Redemption, ein Bild",SearchCreativeWork
Suche nach einem movie called October Road,SearchCreativeWork
Find eine painting called The Legend von Tashan Dorrsett.,SearchCreativeWork
Auf der Suche nach Video-Spiel für Those Who Would Walk mit den Göttern,SearchCreativeWork
Find me Under the Skin,SearchCreativeWork
Finden Sie einen novel called Matching Dreams.,SearchCreativeWork
Ich möchte Plague Soundscapes sehen,SearchCreativeWork
"Findet mir die Fernsehshow Ask a Woman, der weiß",SearchCreativeWork
Ich suche ein Novel-Called und Then There was Light.,SearchCreativeWork
zeigen Kreativität von Sing zum Dawn,SearchCreativeWork
Bringen Sie das Buch Parfum: Die Geschichte eines Mörders,SearchCreativeWork
Please Suche Die jungen Krieger Spiel.,SearchCreativeWork
Suche nach der Welt ist ein Spiel,SearchCreativeWork
Where ist picture Everybody Wants Sie,SearchCreativeWork
show Texas Review von Unterhaltung & Sport Recht creative song,SearchCreativeWork
Ich wollte listen auf die Soundtrack Und Then There war Licht,SearchCreativeWork
Zeigen Sie die Bohnen und die Jungen painting,SearchCreativeWork
Kann ich Geschichten von Ghost Castle finden?,SearchCreativeWork
Finden Sie eine novel called Industrie.,SearchCreativeWork
Suchen Sie einen Fotographen called Zwischen den Tagen,SearchCreativeWork
Find the show Das Schwert des Lictor,SearchCreativeWork
Spielen Sie The XYY Man Soundtrack,SearchCreativeWork
"Ich wollte die Fernsehshow ansehen, Official Detective.",SearchCreativeWork
"find Spielplatz, ein Buch",SearchCreativeWork
Find the Via Dolorosa: Beilage der Redemption saga,SearchCreativeWork
Finden Sie das gute Wife,SearchCreativeWork
"Where kann ich sehen, die picture Reaching Horizons",SearchCreativeWork
Was ist Fantasy Zone II: Die Tränen von Opa-Opa,SearchCreativeWork
Finden Sie Ihren persönlichen Touch.,SearchCreativeWork
find Ein Haustier des Zoos Cairo,SearchCreativeWork
Kann ich die Spielliste von Mew singles bekommen?,SearchCreativeWork
Zeigen Sie mir die Live~Legend 1999 & 1997 Apocalypse TV-Show,SearchCreativeWork
"Ich hupe, du kannst einen Fotographen von Live At The Isle of Wight 1970 finden.",SearchCreativeWork
Find Landing auf Wasser.,SearchCreativeWork
Kann ich das song Visual Audio Sensory Theater anheben?,SearchCreativeWork
find Mash-Verwirrung,SearchCreativeWork
Schnuppern Sie die picture Twin-Ehemänner,SearchCreativeWork
Kann ich die Encounters sehen?,SearchCreativeWork
Ich suche die Birth of a Nation,SearchCreativeWork
play The Case of the Whitechapel Vampire TV series,SearchCreativeWork
Finden Sie eine TV-Show called Full House,SearchCreativeWork
"Findet ein Buch, das das CIA World Factbook enthält.",SearchCreativeWork
Zeig mir Heavenly Sword,SearchCreativeWork
Find an album called The Aboriginal Port Folio.,SearchCreativeWork
Das Carrousel find,SearchCreativeWork
Find das painting Sleeping in deiner Hand,SearchCreativeWork
Finden Sie einen Fotographen called Midnight Mysterium.,SearchCreativeWork
Ich sehe den Trailer für Live Dates,SearchCreativeWork
Ich suche die Televisionsshow The Flame,SearchCreativeWork
Chocolate Rain Kreativität zeigen,SearchCreativeWork
Was ist das verlorene Land des Tigers,SearchCreativeWork
Lokalisieren Sie die Koi to Senkyo auf Chocolate television,SearchCreativeWork
Lesen Sie den Hintergrund zu Danger Buch,SearchCreativeWork
Finden Sie ein Buch called folgen Sie mir,SearchCreativeWork
Findet die novel WWE Legends von WrestleMania,SearchCreativeWork
Please Suche nach dem.... auf einem String-Video-Spiel.,SearchCreativeWork
Painting von Live aus dem El Rey Theater,SearchCreativeWork
Please find die Show Kim Hyun-joong discography,SearchCreativeWork
Lesen Sie die novel On-Line Encyclopedia von Integer Sequences,SearchCreativeWork
Können Sie pull up Mein Name ist Gehirn Brian,SearchCreativeWork
Ich suche nach dem Trailer an Evil oder Divine - Live in New York City.,SearchCreativeWork
Zeig mir einen Novel von Onnaam Muhurtham,SearchCreativeWork
Bitte bringen Sie mir Rough und Ready saga.,SearchCreativeWork
Please hol mir Geschichten aus der englischen und Scottish Ballads Show.,SearchCreativeWork
Finden Sie Z Autos.,SearchCreativeWork
Könnt ihr mir die SchoolTool-Piktur zeigen?,SearchCreativeWork
Show the Glasss Cloud – Single TV series,SearchCreativeWork
Find a show called Star Trek: Sternenflottenakademie Raumschiff Bridge Simulator.,SearchCreativeWork
find PoliticsNation mit Al Sharpton,SearchCreativeWork
Holy Water nachsehen,SearchCreativeWork
Ausstellung von Von Südafrika nach South Carolina,SearchCreativeWork
Buchname zeigen Straight No Chase,SearchCreativeWork
Finden Sie eine Video-Spiel called Peaches Diskografie.,SearchCreativeWork
Where kann ich kaufen das TV series Liar Spiel - Die letzte Stage,SearchCreativeWork
Please Suche nach der Familie von Korra Buch.,SearchCreativeWork
Auf der Suche nach dem Bild Foghat?,SearchCreativeWork
Find Night of Passion,SearchCreativeWork
Was ist das Michael Moore ist ein Big Fat Dupid White Man Videospiel?,SearchCreativeWork
Findet mir die Fruit of Life Television Show.,SearchCreativeWork
Air Cuan Dubh Drilseach anzeigen,SearchCreativeWork
Findet mir die Show The Skull.,SearchCreativeWork
Auf der Suche nach dem Trailer für Shaolin Temple,SearchCreativeWork
play saga Die gelbe Rose von Texas,SearchCreativeWork
Ich fand eine painting called Stimmen in meinem Kopf.,SearchCreativeWork
Können Sie die Show The Dumping Ground Survival Files finden,SearchCreativeWork
Ich suche nach The Complete Fillmore East Concerts,SearchCreativeWork
Ich möchte den Soundtrack zum Platinum Rule anhören.,SearchCreativeWork
Suche nach dem Sung Banquet für den Damned,SearchCreativeWork
Die Arbeit finden Compiled fragments 1997-2003,SearchCreativeWork
Where kann ich den Movie finden Die National Law Review,SearchCreativeWork
When war der Soundtrack für Those Were the Days – Das Beste aus Leningrad published?,SearchCreativeWork
"Finden Sie den echten Dreck auf Farmer John, a19a",SearchCreativeWork
Suchen Sie nach Global Clubbing: Die Netherlands.,SearchCreativeWork
"Find die Arbeit, die ich nach oben",SearchCreativeWork
Finden Sie mich Haunted Castle,SearchCreativeWork
Wie bekomme ich den Soundtrack für Hearts of Fencing?,SearchCreativeWork
Suche nach Chasing Fortune a TV series.,SearchCreativeWork
Zeig mir das Spiel English Freakbeat,SearchCreativeWork
Find eine Show called Big Broadcast von 1938,SearchCreativeWork
find Starcross,SearchCreativeWork
Finden Sie mir die Klingel der Budapest Beacon.,SearchCreativeWork
Blick nach oben Die Sterne Are Indifferent für die,SearchCreativeWork
"Wish zu lesen, die novel called Die Wizard von Stone Mountain",SearchCreativeWork
Kannst du das Notizbuch des Trigorin-Spiels please find finden?,SearchCreativeWork
Zeigen Sie mir das Spiel Music Bank,SearchCreativeWork
Kann ich den Trailer für Experienced II: Embrace Tour 2013 Budokan sehen?,SearchCreativeWork
Den Kampf der Kokainen ausfindig machen.,SearchCreativeWork
Zeigen Sie mir das Out mit meinem Baby-Fotografen,SearchCreativeWork
Zeigen Sie mir die song 15 Storeys High,SearchCreativeWork
Ich würde gerne den Movie Edinburgh Evening News sehen,SearchCreativeWork
Finden Sie die Abbildung Their Finest Hour,SearchCreativeWork
Finden Sie mir die When Harry Tries zu heiraten Fotograph,SearchCreativeWork
Könnt Ihr mir das Stand-Proud-Buch,SearchCreativeWork
"find Waiting für Touchdown, ein Buch",SearchCreativeWork
Nach oben Der Park album,SearchCreativeWork
Suchen Sie nach dem TV series All Around Performance Horse Weekly,SearchCreativeWork
Die Endangered Species-Song finden,SearchCreativeWork
find Oman Medical Journal,SearchCreativeWork
"Ich würde gerne das Spiel sehen, das Gott in der T.V. ge",SearchCreativeWork
Spielen Sie den Soundtrack für Zurück in die Zukunft,SearchCreativeWork
Ich würde gerne die Soulful Nights of Christmas sehen.,SearchCreativeWork
Kannst du West Coast Wrestling Connection locate,SearchCreativeWork
Könnt ihr mir die Dicey Business TV series zeigen?,SearchCreativeWork
Sie mich die Söhne Satans Praise der Herr picture,SearchCreativeWork
Find HeroQuest II: Legacy von Sorasil.,SearchCreativeWork
Kreativ-Fotografen-Insel im Meer anzeigen,SearchCreativeWork
Find a show called Friday Download.,SearchCreativeWork
Besorgen Sie mir die Elvis-Christmas-Album-TV-Show.,SearchCreativeWork
find Zeit Quadratisch,SearchCreativeWork
Finden Sie die TV-Show Starship Titanic,SearchCreativeWork
Spielen trailer von tun Whatever dreht Sie an,SearchCreativeWork
Ich will den Trailer nach Worms 2: Armageddon sehen.,SearchCreativeWork
find Die Welt ist ein Spiel,SearchCreativeWork
Suchen Sie ein Fotograph called XQuery API für Java,SearchCreativeWork
Arbeitet es sich dabei um eine Anekdote für Heterozyklen?,SearchCreativeWork
Find me a saga by reproductions,SearchCreativeWork
Eine Arbeit mit dem Namen Come Sing finden,SearchCreativeWork
"Ich suche nach dir, um mir Jack of Shadows zu besorgen.",SearchCreativeWork
Please find Brand Neue Strings,SearchCreativeWork
Ich würde die Sung abheben und mit mir reden.,SearchCreativeWork
"find Donkey Town, eine Show",SearchCreativeWork
play the song Kultur und Psychologie,SearchCreativeWork
Alle Jets finden Are Gonna Fall Today saga,SearchCreativeWork
Ich möchte das Bild in der alten Monterey sehen.,SearchCreativeWork
Finden Sie die TV-Show When I was a Boy,SearchCreativeWork
Spielen Sie die Lousy Dance Trailer,SearchCreativeWork
Find painting große Ideen,SearchCreativeWork
Suche nach High Chicago,SearchCreativeWork
Suche nach einem Foto von Road Hogs,SearchCreativeWork
Geh zu deinem Herzen und gehöre zu mir,SearchCreativeWork
Zeigen Sie mir Dangers der Kanadier,SearchCreativeWork
"Please search the work, Der Söldner.",SearchCreativeWork
Finden Sie die novel Die Thunder Rolls,SearchCreativeWork
Zeig mir den Tivington Nott,SearchCreativeWork
Ich möchte den movie X Window Display Manager ansehen.,SearchCreativeWork
Was ist die Paranormale Aktivität: Ghost Dimension album?,SearchCreativeWork
Lesen Sie das Open Ecology Journal,SearchCreativeWork
Zeigen Sie mir das Foto A Woman von der Straße,SearchCreativeWork
"find Wish You Were Here, ein Movie",SearchCreativeWork
Ich kann mir die Fernsehserien von W.I.T.C.H. ansehen.,SearchCreativeWork
Finde das Spiel Selling Blue Elephants,SearchCreativeWork
Find me The Rise and Fall of the Great Lakes saga.,SearchCreativeWork
Finden Sie die TV-Shows der Farewell-Tour,SearchCreativeWork
Kann ich einen Hardcover-Kopy aus dem Buch Die Immateriellen der Führung kaufen?,SearchCreativeWork
TV-Show Schedule Archive.is,SearchCreativeWork
Zeigen Sie mir NCAA College Football 2K3,SearchCreativeWork
Den Half Cut Tee finden.,SearchCreativeWork
Please zeigen Sie mir die picture Geschichte Repeating,SearchCreativeWork
Kannst du Wunder im Rain suchen?,SearchCreativeWork
Need die 20a called die schwarze Lamp,SearchCreativeWork
Finde den Movie Shake Your Spirit,SearchCreativeWork
Suche nach einem Painting der Wannadien,SearchCreativeWork
Was ist das Foto von The Cave Canem Demos?,SearchCreativeWork
find die television show Riding mit dem König,SearchCreativeWork
Where kann ich die TV series Polite People ansehen,SearchCreativeWork
Suchen Sie die television show called Taktiken,SearchCreativeWork
Zeigen Sie mir das Bildnis Written in den Sternen,SearchCreativeWork
Find me An Echo in the Darkness,SearchCreativeWork
Besorgen Sie mir ein Foto von Trac,SearchCreativeWork
Find ein Soundtrack called Meet The Vogues.,SearchCreativeWork
Findet den blonden roten Sandmann,SearchCreativeWork
When und where ist DistroWatch spielen,SearchCreativeWork
"Kannst du mir helfen, Teer aus einer Weide zu finden?",SearchCreativeWork
find Krieg und Frieden Vol. 1,SearchCreativeWork
Finden Sie das Video Spiel Thale,SearchCreativeWork
Findet mir die Song 2 Fast 2 Furious,SearchCreativeWork
Where kann ich die Soundtrack Brücke von Souls kaufen,SearchCreativeWork
Where kann ich den Novel Die große Irische Backe ausfindig machen,SearchCreativeWork
Suche nach der television show called Pädagogische Psychologin,SearchCreativeWork
50 Wörter für Schneekreativ-Piktur zeigen,SearchCreativeWork
Kannst du mir die Spectres-Television-,SearchCreativeWork
"find ArcIMS, ein Bild",SearchCreativeWork
Please Suche Durchqueren von Schlamm Wasser Arbeit,SearchCreativeWork
Das kritische Spiel anzeigen,SearchCreativeWork
Ich will die Nacht des Jägers finden,SearchCreativeWork
Video anzeigen game name Find the Colour,SearchCreativeWork
play the song Red Lanta,SearchCreativeWork
find Try Me Out für mich,SearchCreativeWork
"Kannst du das Spiel nachschlagen, die Inselbewohner?",SearchCreativeWork
Ich muss die kreative Arbeit Prince Hours finden,SearchCreativeWork
Ich will die Show von Where bis Eternity finden.,SearchCreativeWork
Where ist Winterhearts Gilde,SearchCreativeWork
Zeigen Sie mir den Rand der Liebe Fotograph,SearchCreativeWork
Kann ich einen painting called Battlestations finden: Pacific,SearchCreativeWork
Show Get It Together in TV-Show,SearchCreativeWork
find soundtrack titled Das Haus des gelben Teppichs,SearchCreativeWork
Zeigen Sie mir das Buch Playlist: Die Very Best of Dolly Parton,SearchCreativeWork
zeigen Sie mir die television show Operation Thunderbolt,SearchCreativeWork
Where can I find Sebastien Grainger & The Mountains,SearchCreativeWork
Könnt ihr den painting Shake finden! Otis in Monterey,SearchCreativeWork
Ich möchte die Show sehen Railroad Model Craftsman,SearchCreativeWork
"Hilf mir, den Tristan Betrayal zu finden",SearchCreativeWork
"Suchen Sie einen Fotographen, der die Wish-Liste getarnt hat",SearchCreativeWork
"Einen Fotographen finden, Cold Weather.",SearchCreativeWork
Findet die Menschensohn-Show,SearchCreativeWork
Suchen Sie nach allen That Matters,SearchCreativeWork
Please get me The Very Best of Chicago: Only the Beginning.,SearchCreativeWork
Show The Blue Meaning television show,SearchCreativeWork
Find book Die Musik-Lovers,SearchCreativeWork
Show Under the Sea kreative video game,SearchCreativeWork
"Kannst du die TV-Show bekommen, ENTER THE MATRIX?",SearchCreativeWork
Find me the novel of A Dictionary of Slang and Unconventional English,SearchCreativeWork
Die Transformer finden: Generationen-Videospiel,SearchCreativeWork
find Thymian Reisen,SearchCreativeWork
zeigen movie CrossGenesis,SearchCreativeWork
Könnt ihr mir die Restless Natives,SearchCreativeWork
Suche nach einem 20a Called Set Sail the Prairie,SearchCreativeWork
zeigen That Little Band of Gold,SearchCreativeWork
"Ich brauche, um die Arbeit Brotherly Love zu finden",SearchCreativeWork
Finden Sie ein painting called Die Wipers Times,SearchCreativeWork
Schauen Sie sich die television show called Monster Mash,SearchCreativeWork
Where kann ich die trailer Extreme – Die Sammlung ansehen,SearchCreativeWork
play the song Memories Are My Only Witness,SearchCreativeWork
Please help me find the Selections from the Arista Years video game.,SearchCreativeWork
"Bitte suchen Sie nach der Arbeit, Wholehearted.",SearchCreativeWork
find Chant Down Babylon: Die Anthologie der Insel,SearchCreativeWork
find Kommende Royston,SearchCreativeWork
zeigen Creativität des Fotographen von Meinem Wundertag,SearchCreativeWork
Die Familie von One End Street zeigen album,SearchCreativeWork
Spielen Sie mir die saga Die Partei,SearchCreativeWork
Ich möchte die TV-Show Cause & Effect sehen,SearchCreativeWork
Ich würde gerne Miss Congeniality zusehen,SearchCreativeWork
find Ein Mann braucht eine Maid,SearchCreativeWork
Kaufen novel Brokeback Mountain,SearchCreativeWork
Ich will die Fernsehshow Treeful of Starling sehen.,SearchCreativeWork
Show The Man aus London video game,SearchCreativeWork
Find In der Linie von Duty: Street War.,SearchCreativeWork
Find a soundtrack called The Christmas Shoes.,SearchCreativeWork
"Ich würde gerne listen, um die Sung Der natürliche Farmer",SearchCreativeWork
zeigen Sie Kreativität Ihres Körpers Above Me,SearchCreativeWork
Finden Sie mich die Reise Weekly,SearchCreativeWork
Find ein Video Spiel called New York 911.,SearchCreativeWork
Find Changes: Eine Liebesgeschichte.,SearchCreativeWork
"Ich wollte das Fernsehen sehen, ein Zustand des Geistes",SearchCreativeWork
Find me the Spartan: Total Warrior painting,SearchCreativeWork
Blick nach oben Die Rückseite des Medals,SearchCreativeWork
Finden Sie die Liebe und Krieg Soundtrack,SearchCreativeWork
zeigen movie Schedule der Big Mouth,SearchCreativeWork
Ein Foto von Adventure Time: Das Geheimnis des namenlosen Königreiches,SearchCreativeWork
"Finden Sie eine Klingelung Dieser Champagne Mojito ist die letzte Sache, die ich own.",SearchCreativeWork
Ich brauche Arbeit von Father Dearest,SearchCreativeWork
"Bitte, find mir die Platinum Box II-Song?",SearchCreativeWork
"Findet eine Televisionsshow, die Merced Sun-Star getarnt hat.",SearchCreativeWork
"Ich suche nach der Televisionsshow, die Justice League gepfiffen hat.",SearchCreativeWork
"Ich suche das Hit-Album, die Politics von Dancing.",SearchCreativeWork
Suche nach den Nationen,SearchCreativeWork
"Findet ein Buch, das den magischen Christmas Tree enthält.",SearchCreativeWork
Zeigen Sie mir die Abbildung Sex und Drugs und Jesus Christus,SearchCreativeWork
Den Fernseher finden Ich baue den Turm auf,SearchCreativeWork
find a novel called Episodi di Sons of Anarchie,SearchCreativeWork
Please look up Two More Years Soundtrack.,SearchCreativeWork
Finden Sie eine television show called Happy Trails,SearchCreativeWork
Find the Exile und das Königreich,SearchCreativeWork
Ich möchte das MAXIMUM TRANCE-Bild sehen.,SearchCreativeWork
Where zu bekommen painting des Mannes in der weißen Suit,SearchCreativeWork
Zeigen Sie mir die Grausamkeit Exhibition,SearchCreativeWork
Find eine soundtrack called Neue Religion.,SearchCreativeWork
find the picture Ultima VI: Der falsche Prophet,SearchCreativeWork
Suche nach dem Painting Hess: Eine Biographie,SearchCreativeWork
Finden Sie mir die Soundtrack called Enter the Chicken,SearchCreativeWork
Spielen Remains des Tages,SearchCreativeWork
"Pull das Video-Spiel, Apothecary Rx",SearchCreativeWork
Die Song Tholireyi Gadichindi find,SearchCreativeWork
Ich würde gerne die Paul Murray Live Television Show sehen.,SearchCreativeWork
Finden Sie mir ein Spiel called Spaceball,SearchCreativeWork
"Show-Krativität des größten Films, der je gelöst wurde",SearchCreativeWork
Suchen Sie nach dem Editor & Publisher TV series,SearchCreativeWork
"Ich will zusehen, wie ich der Fate-Diskografie entkomme.",SearchCreativeWork
Suche nach der kreativen Arbeit Meltdown – Tage der Zerstörung,SearchCreativeWork
Find Trivial Pursuit: Amerika spielt,SearchCreativeWork
Zeigen Sie mir die Movie Haunted Spooks,SearchCreativeWork
Auf der Suche nach Liberalismus und den Grenzen der Gerechtigkeit,SearchCreativeWork
Spielen Sie mir den Trailer für Gainesville Daily Register.,SearchCreativeWork
Den Madwoman auf dem Dachboden finden.,SearchCreativeWork
Ich möchte das Videospiel Die Kojotenkönige des Space-Age Bachelor Pads spielen,SearchCreativeWork
Findet mich die Princess Battles song,SearchCreativeWork
find Journal der Gesellschaft für Amerikanische Musik,SearchCreativeWork
"Ich will die Show finden, die Fresh Aire 7 geläutet hat.",SearchCreativeWork
Finden Sie die picture Chorus Linie,SearchCreativeWork
Was ist Marty Stuart Diskografie,SearchCreativeWork
Suche nach Mann in einer Garage,SearchCreativeWork
Zeigen Sie mir es might as well Rain Until September,SearchCreativeWork
Suche eine TV-Show geballt Engagiert an die Unbekannten,SearchCreativeWork
Find a TV-Show called Zen: Die Musik von Fred Katz.,SearchCreativeWork
Könnt ihr mir die painting zitled Across the Line raten?,SearchCreativeWork
Ich möchte listen zu den Soundtrack Adobe Digital Editions,SearchCreativeWork
Finden Sie einen Fernseher series called When Harry Tries an Marry.,SearchCreativeWork
Ich möchte das Spiel Pesterminator: The Western Exterminator spielen.,SearchCreativeWork
find junge Miss Holmes,SearchCreativeWork
Finde den Trailer für die Spooky Sisters,SearchCreativeWork
Ich suche nach der Fernsehsendung Catchphrase,SearchCreativeWork
find the song Ticks,SearchCreativeWork
Gehen Sie zu BioRuby,SearchCreativeWork
Find Der Garten von Eden,SearchCreativeWork
Man muss eine kreative Arbeit mit dem title Sometimes the Blues Is Just a Passing Bird finden,SearchCreativeWork
Zeigen Sie die Ancient Art of War picture,SearchCreativeWork
"Ich bin Mariah, die unerbittliche Chanteuse.",SearchCreativeWork
Finden Sie die Three Little Pigs television Show,SearchCreativeWork
Suchen Sie ein album called Stumble.Stop.Repeat,SearchCreativeWork
Was ist Party die ganze Nacht,SearchCreativeWork
Könnt ihr mir einen Trailer für Phineas Redux,SearchCreativeWork
Holen Sie mir Informationen über die Riverfront Times,SearchCreativeWork
Ich kann einsame Herzen finden.,SearchCreativeWork
Zeig mir die Arbeit Nicht ein kleines Mädchen Anymore,SearchCreativeWork
Ich würde die Sung in einer Reverie anhören.,SearchCreativeWork
"Find Glocken brechen Their Towers, ein Video-Spiel",SearchCreativeWork
Ich möchte die Fernsehshow Sinfonie für Solo-Klavier sehen.,SearchCreativeWork
Zeig mir den painting called Narr für die Liebe.,SearchCreativeWork
Please find the album Die Partei Scene,SearchCreativeWork
Wer zum Buch kaufen Charlie Countryman deve morire,SearchCreativeWork
Suche nach der Show Champagne Showers,SearchCreativeWork
Zeigen Sie mir die movie Black Summer,SearchCreativeWork
Where kann ich die Show finden Spiel des Todes II,SearchCreativeWork
Suchen Sie ein Video Spiel called Krater des Sac,SearchCreativeWork
Find an album called Liste der Re: Hamatora episodes.,SearchCreativeWork
"Where kann ich finden, die gattungssüchtige zu lieben",SearchCreativeWork
"Könnt ihr mir den Movie, das Mädchen und den General zeigen?",SearchCreativeWork
Spielen Sie die Elektrochemie und Solid State Letters song,SearchCreativeWork
find the show titled Hölle auf Erden 2006,SearchCreativeWork
Kannst du die Stadt der Narben suchen?,SearchCreativeWork
Please look up the Power and Love movie.,SearchCreativeWork
"find Five SpanishSong, ein Fotograph",SearchCreativeWork
Wollen die Dungeoneons & Dragons sehen: Chronicles of Mystara,SearchCreativeWork
Schauen Sie nach oben dies ist Halloween Trailer,SearchCreativeWork
Könnt ihr mir den Movie TheCountess zeigen?,SearchCreativeWork
Finden Sie die movie Everywhere Aber Zuhause,SearchCreativeWork
Where kann ich das Spiel herunterladen Miss Robin Hood,SearchCreativeWork
Where kann ich kaufen das Lügen Spiel,SearchCreativeWork
Zeigen Sie die Minuten bis Midnight-Fotograf,SearchCreativeWork
Zeigen Sie mir das Video Spiel When In Rome 2007,SearchCreativeWork
Bitte bringen Sie mir das National Medical Journal of India Spiel.,SearchCreativeWork
Kann ich den Movie The Teahouse Fire kaufen?,SearchCreativeWork
Ist die television show Kamen Rider OOO Wonderful: Der Shogun und die 21 Core Medals streamen Anywhere?,SearchCreativeWork
"find zurück für das Gute, ein Novel, den ich lesen wollte",SearchCreativeWork
"Kannst du mir helfen, ScholarMate zu finden?",SearchCreativeWork
Finden Sie eine painting called Pulsions.,SearchCreativeWork
Findet einen Novel Called Kiss Me Licia.,SearchCreativeWork
Ich suche den Trailer von Highlands Today,SearchCreativeWork
find Wort von Mouth für mich,SearchCreativeWork
Findet mir die Schnürsenkel und Whiskey Soundtrack,SearchCreativeWork
Please-Suche Cardin in Australien,SearchCreativeWork
Finden Sie den Fernseher series The Parent Trap IV: Hawaiian Honeymoon,SearchCreativeWork
Finde den Nobel Der Letzte von Sheila,SearchCreativeWork
Where kann ich kaufen die TV-Show Zeit für Helden,SearchCreativeWork
play the album Journeyman,SearchCreativeWork
Where kann ich das Spiel Legion of Mary: The Jerry Garcia Collection locate,SearchCreativeWork
Please pull nach oben Nothing Feels gut,SearchCreativeWork
