text,intent
Another song zur Cita Romántica Playlist hinzufügen.,AddToPlaylist
Fügen Sie clem Burke in meiner Playlist Pre-Party R&B Jams hinzu,AddToPlaylist
Live von Aragon Ballroom zu Trapeo hinzufügen,AddToPlaylist
Unite und Win zu meiner Night Out hinzufügen,AddToPlaylist
Track zu meinen Digster Future Hits hinzufügen,AddToPlaylist
Fügen Sie die Piano-Bar zu meinem Cindy Wilson,AddToPlaylist
Spanish Harlem Incident zum Verschleichen des Hauses hinzufügen,AddToPlaylist
Fügen Sie die Grauesten der blauen Himmel in Indie Español meine Playlist hinzu,AddToPlaylist
Fügen Sie den Namen kids in der Street auf die plylist New Indie Mix,AddToPlaylist
album radar latino hinzufügen,AddToPlaylist
Trenquility zur lateinischen Pop Rising-Playlist hinzufügen.,AddToPlaylist
Fügen Sie d flame zur Dcode2016-Playliste hinzu.,AddToPlaylist
Füge album zu meinen Feentalen hinzu,AddToPlaylist
Ich brauche einen anotheren Künstler in der New Indie Mix Playlist.,AddToPlaylist
Zu Playlist hinzufügen ich liebe mein neo soul das name nationale treasure book of secrets,AddToPlaylist
Füge das Feuer und den Wind zu meiner Digster Future Hits Playlist hinzu.,AddToPlaylist
Caleigh Peters zu meinen Frauen der country list hinzufügen,AddToPlaylist
Hinzufügen von children von telepathischen Erfahrungen zu der Playlist named baladas románticas,AddToPlaylist
9. Inning zu meiner Bossa nova Dinner Playlist hinzufügen,AddToPlaylist
Ich brauche ein Another tune in meiner legdary Guitar solos Playlist.,AddToPlaylist
Fügen Sie Slimm Cutta Calhoun zu meinem Dies ist prince Playlist.,AddToPlaylist
Fügen Sie Always zu dena's Baroque 50 Spotify Picks Playlist hinzu.,AddToPlaylist
Song zu Sleepytime hinzufügen,AddToPlaylist
Füge ein Album zu meiner Liste La Mejor Música Dance 2017 hinzu,AddToPlaylist
"hinzufügen Hey, Johnnie Cope, Are Ye Waking Yet zu Jahr in metal 2016 Playlist",AddToPlaylist
Fügen Sie das Album zur Psychedelic rock playlist hinzu,AddToPlaylist
"Kannst du esquivando charcos zu meiner Playlist hinzufügen, die die Piano-Bar entitled",AddToPlaylist
Wiktor coj zur Sleep Playlist hinzufügen.,AddToPlaylist
Zeit warp in meine Märchen-Tales-Playlist aufnehmen.,AddToPlaylist
Fügen Sie diese MakSimune zu Trad Folk,AddToPlaylist
Hinzufügen zu meiner Playlist eletro br,AddToPlaylist
Fügen Sie dieses Gerät zu meiner Dinnertime-Acoustics-Liste hinzu,AddToPlaylist
monsters hinzufügen dies ist prince playlist,AddToPlaylist
Fügen Sie eine Liste in Chill Vibes hinzu,AddToPlaylist
Kannst du einen Track zu meiner Spain Top 50 Playlist hinzufügen?,AddToPlaylist
put dieses Album von Mike Tramp auf Deathcore,AddToPlaylist
ross den boss zu lauries listas de éxitos list hinzufügen,AddToPlaylist
Fügen Sie some Beatmaster V zu der Playlist This Is Nicky Jam hinzu.,AddToPlaylist
paulinho da viola zu meiner Radio Rock-Songliste hinzufügen,AddToPlaylist
Eef Barzelay zu meinem Country Coffeehouse hinzufügen,AddToPlaylist
Fügen Sie diesen Künstler zu queen playlist hinzu,AddToPlaylist
Olga Souza zu Virginias femme fatale Playlist hinzufügen,AddToPlaylist
Füge ein Album von m g sreekumar zu meiner laidback akustischen Playlist hinzu.,AddToPlaylist
Füge dieses Album zu meiner Spotify-Orchestra-Cello-Playlist hinzu,AddToPlaylist
Ich möchte Goldy Mcjohn auf meine Rock Party-Playlist,AddToPlaylist
Fügen Sie diese song noreen fresh finds six strings,AddToPlaylist
Eine Shawnna an die warmen Herzen Feel Gute Playlist.,AddToPlaylist
Fügen Sie dies zu Rock Save The Queen hinzu,AddToPlaylist
Füge Firehouse zu meiner akustischen Soulliste hinzu.,AddToPlaylist
Fügen Sie diesen David Cole Track zu meinem Totally Stress Free hinzu,AddToPlaylist
Füge Progress zu meiner clásica para todos playlist hinzu.,AddToPlaylist
Fügen Sie die Artist tony thompson zu meiner canta en la ducha playlist,AddToPlaylist
Füge den Künstler zu meiner Playlist This Is Mozart hinzu.,AddToPlaylist
Fügen Sie diesen Track zu Downtempo Beats hinzu,AddToPlaylist
Fügen Sie Quicksand zu meiner valentine's Day Love Playlist hinzu,AddToPlaylist
Fügen Sie feel die Passivität zu meinem Dies ist Kudai Playlist.,AddToPlaylist
füge diese Sung zu meiner us latin Top 50 Playlist hinzu,AddToPlaylist
Put dieser Künstler in Pachangueo Total,AddToPlaylist
vl mike zu meiner Dcode2016-Spielliste hinzufügen,AddToPlaylist
how zu meiner week end Playlist hinzufügen,AddToPlaylist
Fügen Sie Norma Jean zu meiner pure rock & roll Playlist hinzu.,AddToPlaylist
Kirk Hammett zu Calm nach unten hinzufügen,AddToPlaylist
Hinzufügen mit der Show zu meiner Beast-Modus-Playlist,AddToPlaylist
Kjetil vidar haraldstad zu listas de éxitos hinzufügen,AddToPlaylist
können Sie xanadu zur lateinischen Alternative Musik hinzufügen,AddToPlaylist
Fügen Sie diesen Track zum Krystal-Klavier 100 hinzu,AddToPlaylist
Können Sie diesen Track auf die Playlist des Selektors setzen?,AddToPlaylist
mein jazz für liebende couples needs mehr push den knopf,AddToPlaylist
füge das album der martin garrix zu meiner playlist hinzu,AddToPlaylist
Gina 77 zum Workout twerkout hinzufügen,AddToPlaylist
Fügen Sie diese Funktion zu Cristinas Endorphin-Rush-Playlist hinzu,AddToPlaylist
füge dieses Gerät zu meiner Es ist eine Southern Thing Playlist hinzu,AddToPlaylist
Ik Tara zu Wäscherei Playlst hinzufügen,AddToPlaylist
Fügen Sie dieses Gerät zu This Is Nicky Jam hinzu,AddToPlaylist
Kannst du meine Chill Tracks Playlist mit dem Künstler Paul Cargnello versöhnen?,AddToPlaylist
Fügt Runaljod gap var Ginnunga zur Spielliste von ishlee titled forever country hinzu,AddToPlaylist
Put Die Orange und das Grüne auf Los 40 Radio Éxitos,AddToPlaylist
Fügen Sie ein Album von Liza Oumarova zur Steampunk-Playlist hinzu.,AddToPlaylist
Please fügt eine Sung zu ines' playlist called Metal Party hinzu,AddToPlaylist
Für Playlist todo latino hinzufügen Absolutely Sweet Marie,AddToPlaylist
hinzufügen gn zu night vibes,AddToPlaylist
Kannst du Blood On The Face der Playlist Colled Heartland Country hinzufügen?,AddToPlaylist
Die spring classical playlist braucht Partner in Crime hinzugefügt.,AddToPlaylist
fügen Sie den Künstler Tomohisa Yamashita zur Conexiones Playlist hinzu,AddToPlaylist
Fügen Sie Written in Rot zu meinem Cleaning der House-Playlist hinzu.,AddToPlaylist
Hinzufügen cordell mosson zu my i love my neo soul list,AddToPlaylist
Album zu Feeling Blue hinzufügen,AddToPlaylist
Ich möchte ein another album in die peaceful rush hour playlist.,AddToPlaylist
Öffne meine akustische Konzentrations-Playlist und spiele ein entire album,AddToPlaylist
Sonntag zu meinem Assassin's Creed hinzufügen,AddToPlaylist
Ich möchte mehr Francis Healy in der Rockin' Vibes Playlist.,AddToPlaylist
Hinzufügen von Gareth Gates zu meiner autumn Playlist,AddToPlaylist
hinzufügen zu sxsw fresh playlist,AddToPlaylist
Track zu todo latino hinzufügen,AddToPlaylist
Zu meiner Veranoliste eine Sung von Andy Lee hinzufügen,AddToPlaylist
Song zu meinen Club Hits hinzufügen,AddToPlaylist
Fügen Sie diese tune zu meiner Playlist titled uncharted 4 Nathan Drake,AddToPlaylist
Fügen Sie 100% te ljubam in die Hit Remix-Playliste,AddToPlaylist
Put dieses album auf total alternative,AddToPlaylist
put dieses album in beckys infinite indie folk playlist,AddToPlaylist
Fügen Sie Yuna Ito zu den Hot Rods & Horror Shows Playlist hinzu.,AddToPlaylist
Fügen Sie den Künstler Ruby zu meiner digging now list,AddToPlaylist
füge dieses Gerät zu meiner Es ist eine Southern Thing Playlist hinzu,AddToPlaylist
Fügen Sie das Album zu den Top 100 country Tracks auf der Spotify Playlist hinzu.,AddToPlaylist
Fügen Sie diesen Track zur klassischen Musik für smart kids playlist hinzu,AddToPlaylist
Fügen Sie ein Album zu Corinne's Beast Mode Playlist hinzu.,AddToPlaylist
Include das Album von Arthur Rhames in Urban Poet,AddToPlaylist
"Ich brauche, um die all things post beginnen mit meinen favorites aus der Stille hinzufügen",AddToPlaylist
Hinzufügen von Nothing Fancy zu Meditate zu Sounds of Nature Playlist,AddToPlaylist
CJ Snare zu meiner Indie-Mim-Playlist hinzufügen,AddToPlaylist
Ernie Hawkins zur Dubstep-Playlist hinzufügen.,AddToPlaylist
Please put diese Song auf meine Urban Hits Playlist.,AddToPlaylist
add The Spine Surfs Alone zu meiner Playlist called The Funny Thing About Football Is,AddToPlaylist
Ajoy Chakrabarty zu Frauen der country Playlist hinzufügen,AddToPlaylist
addieren Sie diese song zu brooklyn beat,AddToPlaylist
Können Sie some disco zu meiner Playlist called Genuine R&B hinzufügen?,AddToPlaylist
Anthony Hamilton zu meiner Liste hinzufügen Women of Hip Hop,AddToPlaylist
Add as I was Going to St Ives auf der fantasía playlist.,AddToPlaylist
put paula abdul auf Musica Española 2017,AddToPlaylist
Fügen Sie die Entität Por una cabeza zu meiner Playlist Forever Alone,AddToPlaylist
Gleis zum Afternoon Train Ride hinzufügen,AddToPlaylist
Fügen Sie silver apples zu teh sin estrés playlist hinzu.,AddToPlaylist
Please füge diese Sung zu meinem llegando a casa palylist hinzu,AddToPlaylist
Fügen Sie die Sung der martin garrix Show Playlist hinzu,AddToPlaylist
Mehr David Wolfenberger zu meiner Duetos Playlist hinzufügen.,AddToPlaylist
Ich möchte Club Mix in die Playlist mit dem Titel 50 Clásicos,AddToPlaylist
Eric Bibb zum Country Coffeehouse hinzufügen,AddToPlaylist
Gregg Bissonette zu meiner US Latin Top 50-Playlist hinzufügen,AddToPlaylist
track 70s smash hits zu meinem hinzufügen,AddToPlaylist
füge dieses Album zu meiner Blues-Playlist hinzu,AddToPlaylist
Ich wollte diese Sung auf der Playlist Called Chill Vibes,AddToPlaylist
Fügen Sie diese adam clayton tune zu sxsw fresh playlist,AddToPlaylist
Fügen Sie diesen Teddy Charles album zu diesem ist pavarotti meine Playlist,AddToPlaylist
Kannst du meine Playlist called Clásica mit Begrüssungen ergänzen?,AddToPlaylist
Bitte füge Tobymacs Song auf die Indiespensables Playlist hinzu.,AddToPlaylist
fügen Sie ein Album zur Playlist Emily Dickinson hinzu,AddToPlaylist
Fügen Sie Buddy DeSylva zu meinem Dies ist j Balvin Playlist,AddToPlaylist
ad Czarna dziewczyna zu instrumentale madness playlist,AddToPlaylist
Ich möchte diese Sung zu meiner Infantil-Playlist hinzufügen.,AddToPlaylist
hinzufügen vera zu meiner 80er Jam Session Playlist,AddToPlaylist
Hinzufügen einer Zusammenstellung von Warped Music II zur workout twerkout playlist,AddToPlaylist
Füge einen Track zu meiner Liste hinzu Made in Puerto Rico,AddToPlaylist
Fügen Sie diesen Track zu meiner epic Wand der Sound Playlist hinzu,AddToPlaylist
Michael LePond zur elektronischen Bliss hinzufügen,AddToPlaylist
Anla au zur Spielliste radar latino hinzufügen,AddToPlaylist
hinzufügen artist abdel halim hafez zu meine conexiones playlist,AddToPlaylist
Zu diesem Track hinzufügen ist puccini,AddToPlaylist
Ich muss meiner neuen Jork-Playlist eine Song hinzufügen.,AddToPlaylist
Fügen Sie diesen Künstler zu dieser ist Rosana,AddToPlaylist
Joelia Savitsjeva in 88 Schlüsseln hinzufügen,AddToPlaylist
alain caron zu meiner Reise-Playlist hinzufügen,AddToPlaylist
Füge das r l burnside album zu meiner Nothing But A Party R&B Playlist hinzu,AddToPlaylist
Steve Jordan zu inez' Tgif hinzufügen,AddToPlaylist
Hinzufügen zu meiner Playlist alle gefunkt bis dieser Track,AddToPlaylist
Add satisfied zu meiner Rockin' Vibes Playlist,AddToPlaylist
Fügen Sie diesen Künstler named Prince zur Playlist alle neu jetzt,AddToPlaylist
Füge Billy Strayhorn zu meiner Highway 61 Playlist hinzu,AddToPlaylist
Fügen Sie ramble auf Halloween Tees,AddToPlaylist
Diese Sung zu Rock Party hinzufügen,AddToPlaylist
Ich möchte meine Playlist lo que suena new york um lady maisry ergänzen,AddToPlaylist
Ich möchte ein Album zu noreens Endorphin-Rush-Playlist hinzufügen.,AddToPlaylist
Famous zu meiner Playlist hinzufügen lo que suena new york,AddToPlaylist
Füge Shawn Camp zu meiner Soulful-Disco-Playlist hinzu.,AddToPlaylist
bonobo zu queen playlis hinzufügen,AddToPlaylist
hold my liquor zu electroNOW hinzufügen,AddToPlaylist
Fügen Sie Tobias Sammet zu meinem mitbringen zurück die 90er list,AddToPlaylist
Fügen Sie Jack Be Nimble zu meiner reggae bombastic Liste hinzu,AddToPlaylist
jan smit in endorphin rush hinzufügen,AddToPlaylist
Rupie zu meiner Ultra Metal Playlist hinzufügen,AddToPlaylist
Please füge Liberty Forever zur Roadtrip-Playlist hinzu.,AddToPlaylist
Gene clark zu Dianns Liste hinzufügen,AddToPlaylist
Put another track in my electronica & dance playlist.,AddToPlaylist
Fügen Sie das Gerät zur Indie Workout-Playlist hinzu,AddToPlaylist
Fügen Sie david henry hwang zur Playlist This Is Nicky Jam hinzu.,AddToPlaylist
Fügen Sie diesen Jane Olivor Track zu meinen The Sleep Machine Waterscapes hinzu,AddToPlaylist
Ich wollte diesen Künstler auf Drum & Breaks zaubern.,AddToPlaylist
Include dschiwan gasparjan in beth's rare groove playlist.,AddToPlaylist
Ich würde gerne den Künstler Jesper Kyd auf meine fresh elektronische Playlist hinzufügen.,AddToPlaylist
Joplin im Konzert zu meinem feel good Dinner hinzufügen,AddToPlaylist
füge Harry J zu meinem Dubstep Dangles,AddToPlaylist
Hinzufügen von Partnern in Crime zu Joanns Lo Que Suena Los Angeles,AddToPlaylist
Hinzufügen dieser song onto hip hop gaming playlist,AddToPlaylist
"Fügen Sie diesen Künstler zu meiner Spielliste ""Is Philip Glass"" hinzu",AddToPlaylist
Ich möchte auf die Playlist named 80s Classic Hits schauen.,AddToPlaylist
"Keine Geheimnisse hinzufügen, um power gaming playlist",AddToPlaylist
Track zu Hit Remix hinzufügen,AddToPlaylist
ali lohan songs in Club Hits hinzufügen,AddToPlaylist
Fügen Sie diese Funktion zum Retrowave Outrun hinzu,AddToPlaylist
Füge einen Track von The Edge zu meiner funk soul disco playlist hinzu,AddToPlaylist
hold tight zu meiner throwback Party hinzufügen,AddToPlaylist
put Do You Love Me auf meine akustische Soul Playlist,AddToPlaylist
Den Namen Die 3. Welt der Playlist Rock Me UP hinzufügen,AddToPlaylist
Fügen Sie diese Funktion zu meiner Playlist named Women of Fresh Finds hinzu,AddToPlaylist
hinzufügen zu atmospherische schwarze metal playlist,AddToPlaylist
Sammy Hagar zum Ultra Metal hinzufügen,AddToPlaylist
Fügen Sie 2120 south mirigan avenue zu meiner Wäscherei-Playlist hinzu,AddToPlaylist
Turk zur Deep house Playlist hinzufügen,AddToPlaylist
Addieren Sie den Namen Not Fade Away zu der Wiedergabeliste die Mitte hour,AddToPlaylist
fügen Sie den Künstler in die 90er Baby Makers Playlist,AddToPlaylist
Fügen Sie parempi mies zur Spielliste Café con Leche hinzu.,AddToPlaylist
Legen Sie das hier auf meinen Diner für 2 Playlists.,AddToPlaylist
Exit hinzufügen zu ich liebe meine 80er Jahre rollerdisco list,AddToPlaylist
Hinzufügen von Darkest Angels zu meinem SOS 48 2016,AddToPlaylist
Please put another tune in die Wäscherei-Playlist.,AddToPlaylist
Global Underground 006 sydney zu meinem besten Metal des Neuen Jahrtausends hinzufügen,AddToPlaylist
BSlade zu women von k-pop playlist hinzufügen,AddToPlaylist
Fügen Sie der Conexiones-Playlist einen Deasy Track hinzu.,AddToPlaylist
Fügen Sie J J Cale zu meiner schweren Spielliste hinzu.,AddToPlaylist
album zu metal overload playlist hinzufügen,AddToPlaylist
Füge die Keep Your Receipt EP zu meiner Digster Reggae Playlist hinzu.,AddToPlaylist
Country Nights von A Journal of the Plague Year zur Playlist hinzufügen,AddToPlaylist
ian Gillan zu meiner Rock Party hinzufügen,AddToPlaylist
Fügen Sie Paul Young zu meinem Retrovisor hinzu,AddToPlaylist
nana tanimura zu einem sudden rainstorm hinzufügen,AddToPlaylist
Viktor Tsoi zu meiner Sweet-Soul-Chillout-Playlist hinzufügen,AddToPlaylist
Ich wollte Glam in die ntc gym strong Playlist,AddToPlaylist
"Fügen Sie diesen Ricardo Villalobos Track hinzu, um das Surface zu verbessern",AddToPlaylist
Ich möchte eine Sung von w c clark zu meiner Nerding eine Runde Playlist hinzufügen,AddToPlaylist
Fügen Sie connee boswell zur relaxing playlist hinzu.,AddToPlaylist
Nicole Mitchell zu meiner Soul Revived Liste hinzufügen,AddToPlaylist
hinzufügen artist lo mejor de los 00's,AddToPlaylist
dieser Track should gehen auf meine evening chill playlist,AddToPlaylist
Fügen Sie Claudine Longet zu meinem Ultimate 00s-Palylist hinzu,AddToPlaylist
Füge ein mina caputo album zu meiner Achter-Hours-Party hinzu,AddToPlaylist
Put frank portman in meiner Playlist GOOD Music,AddToPlaylist
Diesen Track von The Edge auf meiner funk soul disco playlist,AddToPlaylist
Fügen Sie einen Jang-Nara-Track zur Hip-Hop-Gaming-Playlist hinzu.,AddToPlaylist
Fügen Sie kurious jorge zu meinem synth pop,AddToPlaylist
Songs in 90's hip hop des Künstlers hinzufügen,AddToPlaylist
Fügen Sie Schritt zu Mir der 50 Clásicos-Playlist hinzu.,AddToPlaylist
Fügen Sie diesen Track zur Sunshine Reggae Playlist hinzu,AddToPlaylist
put dieses wole album auf die playlist called old school metal,AddToPlaylist
Füge De Principii Evangelikum zu meinem Domingo Indie-Palylist hinzu,AddToPlaylist
füge an der velvet lounge zurück zu meiner cleaning playlist,AddToPlaylist
hinzufügen Hemanta Kumar Mukhopadhyay album in Funky Jams,AddToPlaylist
Track zu kickass metal hinzufügen,AddToPlaylist
Song zu meinem Pop Brasil hinzufügen,AddToPlaylist
Bitte füge Ruud Jolie zu meiner Playlist hinzu Gästeliste Polygon,AddToPlaylist
Diese agent m tune onto de cantautor español.,AddToPlaylist
füge diese von Kurt James zur Playlist latin pop classics hinzu,AddToPlaylist
Include When Ich male meine Masterpiece in meiner Acoustic Spring Playlist.,AddToPlaylist
ths album zu meinem Pachangueo hinzufügen Total,AddToPlaylist
repent replenish repeat zu klassischen Momenten in Filmen hinzufügen,AddToPlaylist
Add this song to this is no te va gustar playlist,AddToPlaylist
157 Riverside Avenue zur Animal Humor Playlist der Leticia hinzufügen,AddToPlaylist
addtiere zu Composer Weekly Pauline Oliveros Playlist,AddToPlaylist
Füge Stuck auf Nothing zu meiner Sax und der City Playlist hinzu,AddToPlaylist
Armistead Burwell smith iv zu Blues Masters hinzufügen,AddToPlaylist
fügen Sie ein Album in meiner Playlist In The Name Of Blues hinzu,AddToPlaylist
United Abominations auf meine rare groove Playlist setzen,AddToPlaylist
LaGaylia Frazier zu meinem Emotron hinzufügen,AddToPlaylist
Ich möchte eine Sung von w c clark zu meiner Nerding eine Runde Playlist hinzufügen,AddToPlaylist
"Ein Shot bei Glory hinzufügen, um den Storm zu before",AddToPlaylist
fügen Sie diesen Künstler der Playlist called Fusion Fest hinzu,AddToPlaylist
Song zu meiner Mellow Beats Liste hinzufügen,AddToPlaylist
Fügen Sie Don und Sherri zur Spielliste electrosafari hinzu.,AddToPlaylist
"Kannst du eine Sung von jessica mauboy auf meine Playlist setzen, die einen sudden rainstorm entitled hat?",AddToPlaylist
M-CABI zur Playlist named Pre-Party R&B Jams hinzufügen,AddToPlaylist
In Residence metal hammer episode 6 eine Sung hinzufügen,AddToPlaylist
Fügen Sie The Stars and Stripes Forever zur Soulful-Disco-Playlist hinzu.,AddToPlaylist
Füge umjing huanying ni zu meiner Workday Lounge Playlist hinzu,AddToPlaylist
Ich möchte einen Track zu meiner Evening Groove Playlist hinzufügen,AddToPlaylist
hinzufügen Wie sos 48 2016 Wiedergabeliste,AddToPlaylist
Können Sie dj kay slay auf die 2010 Decade Playlist setzen?,AddToPlaylist
Fabri Fira zu evening acoustic hinzufügen,AddToPlaylist
Fügen Sie dieseTue zu Escapada hinzu,AddToPlaylist
Fügen Sie die Entrückung zu Marinas Playlist hinzu Es ist eine südliche Sache,AddToPlaylist
put dieser artist in meine found them first playlist please,AddToPlaylist
Stephen McNally zu Confidence Boost hinzufügen,AddToPlaylist
Paul Franklin zu meiner Bachelor Party hinzufügen,AddToPlaylist
Fügen Sie einen Track zur Another Glass Playlist hinzu.,AddToPlaylist
Please füge einen Track von david freiberg zu meiner Workout-Playlist hinzu.,AddToPlaylist
Fügen Sie diesen Künstler zu meiner feel good Dinner Playlist hinzu,AddToPlaylist
hinzufügen vintage 74 zu meinem Mother's Primavera Sound 2016 Barcelona Playlist,AddToPlaylist
Fügen Sie ein Album von cowboy troy zu meinem Klavier in der Hintergrund-Playlist.,AddToPlaylist
Fügen Sie Hatfield und den Norden zu meiner Hot House-Playlist hinzu.,AddToPlaylist
Fügen Sie tour generación rbd en vivo zur roadrunner rec neue Releases Playlist hinzu.,AddToPlaylist
"Ich möchte, dass die Weltspitze 50 dazu kommt, dass Marit Bergman dazukommt.",AddToPlaylist
Die Blockbrochure hinzufügen Willkommen auf dem Boden 6 auf meinem Café con Leche list,AddToPlaylist
Hinzufügen paul wright album zu 90s Smash Hits Playlist,AddToPlaylist
Füge einen Künstler zu meiner Playlist hinzu This Is Verdi,AddToPlaylist
"Fügen Sie eine Liste hinzu, die animal collective playlist ist.",AddToPlaylist
Fügen Sie dieses manson zu Latin Party Anthems hinzu,AddToPlaylist
Zu meiner Throwback-Donnerstags-Playlist,AddToPlaylist
Füge das Album von Cham zu meiner Cloud Rap Playlist hinzu,AddToPlaylist
Atticus Ross zur Spielliste von electrosafari hinzufügen,AddToPlaylist
Fügen Sie diesen Künstler zu Spain Top 50,AddToPlaylist
Put Lindsey Cardinale in die Kinder-Hillary-Clinton's-John-Month-Playlist meines,AddToPlaylist
Fügen Sie ein Tor Though Bloodstained Mirrors zu feelin' good playlist,AddToPlaylist
Put some frank ferrer in meine edna st vincent millay playlist.,AddToPlaylist
Madman zur Spielliste von Trap Land hinzufügen,AddToPlaylist
Hinzufügen von chas chandler zu meinen Aux Cord-Vitrograms,AddToPlaylist
put Kan Mikami auf Pre-Party R&B Jams,AddToPlaylist
laß die Season in meine Lo-Fi-Liebe hinein,AddToPlaylist
Fügen Sie diesen Track zur 70er smash hits Playlist hinzu,AddToPlaylist
put any Andrew Hurley album onto timeless love songs,AddToPlaylist
hinzufügen Be Yourself Tonight zu I Love My 90s Hip Hop,AddToPlaylist
track zu meiner Las Canciones Más Lindas Del Mundo Playlist hinzufügen,AddToPlaylist
fügen Sie diese Roy Orbison song onto Frauen von Comedy,AddToPlaylist
Artist zur Wäscherei hinzufügen,AddToPlaylist
Eine Bum Note und eine Schweißperle zu meiner Stress Relief Playlist hinzufügen,AddToPlaylist
Sara Hickman zu meiner Targeted-Liste hinzufügen,AddToPlaylist
Jonathan Arons zu meiner Indie Electronics Playlist hinzufügen,AddToPlaylist
Track zu meinem Cloud Rap hinzufügen,AddToPlaylist
füge diese Sung zu meiner Playlist under Funky Jams hinzu,AddToPlaylist
Fügen Sie Mary Wells Sings My Guy zur electro sur Playlist hinzu.,AddToPlaylist
Hinzufügen zu Soft Rock Playlist,AddToPlaylist
D-Day-Dodgers zu meiner Running-Power-Playlist hinzufügen,AddToPlaylist
Ich wollte eine Sung von John schlitt in der bajo las estrellas Playlist.,AddToPlaylist
Fügen Sie vikku vinayakram zu meinem Dies ist Nicky Jam,AddToPlaylist
Bossa Nova Soul Samba zu meiner Jukebox hinzufügen boogie rhythm & blues playlist,AddToPlaylist
Fügen Sie brad Kane zum Pumpeisen-Soundtrack hinzu.,AddToPlaylist
Bitte fügen Sie diese Sung zu indiespain list,AddToPlaylist
Fügen Sie od mene se odvikavaj zu meiner Wäscherei hinzu,AddToPlaylist
Fügen Sie diesen Künstler zu Dubstep,AddToPlaylist
Fügen Sie das Gerät zu Ihrer Favorite Slaughterhouse-Spielliste hinzu.,AddToPlaylist
Song zu Siesta hinzufügen,AddToPlaylist
Put Lullaby von Birdland auf die Infusions-Fang.,AddToPlaylist
Sarah Blasko auf meine The MetalSucks Playlist setzen,AddToPlaylist
Ich wollte etwas ruhigere Tracks zur koreanischen OSTs-Playlist hinzufügen.,AddToPlaylist
Fügen Sie Creme zur funk-Playlist hinzu.,AddToPlaylist
Bringen Sie mich zurück zu Dear Old Blighty zu meiner Dinner-Playlist,AddToPlaylist
Fügen Sie dieses Gerät der Deep Dark Indie Folk Playlist hinzu,AddToPlaylist
füge diese Gisela-Song zu meinem Tanzsaal der Ficial hinzu,AddToPlaylist
Add histoire de melody nelson zu meiner 90's Baby Makers Playlist,AddToPlaylist
füge das zu meiner Roadtrip-Playlist hinzu,AddToPlaylist
Zu Infinite indie folk hinzufügen,AddToPlaylist
Album zu Ultra Metal hinzufügen,AddToPlaylist
Ich würde gerne dieses Album zu Funtime hinzufügen.,AddToPlaylist
hinzufügen zu punk español,AddToPlaylist
"Ich möchte In the Mood zu meiner Playlist hinzufügen, die meine folksige Liebe",AddToPlaylist
Put this Jerry Dixon song on to my Tokyo Rising playlist.,AddToPlaylist
Duetos mit grim skunk,AddToPlaylist
"Fügen Sie Jennie, Jennie zu meiner metal Playlist hinzu",AddToPlaylist
füge Días Felices zu meiner todo-Reggaeton-Playlist hinzu,AddToPlaylist
Füge Candlelight zu meiner House Afterwork-Playlist hinzu.,AddToPlaylist
Us Placers zu meinen neuen Booten hinzufügen,AddToPlaylist
Fügen Sie diesen Track von clem burke zu meiner atmospherischen schwarzen metal Playlist hinzu,AddToPlaylist
Mayya zur de manhattan con amor playlist hinzufügen,AddToPlaylist
Füge die Nastya Kamenskih-Song zu meiner Martin Garrix Show-Playlist hinzu.,AddToPlaylist
Künstler zur Spielliste Epic Gaming hinzufügen,AddToPlaylist
Robin s zu sxsw latin hinzufügen,AddToPlaylist
Setzen Sie dies auf die signierte Xoxo-Playlist.,AddToPlaylist
Olympia 1959 von der delta nach chicago hinzufügen,AddToPlaylist
Die Enamorándose-Playlist braucht ein another album.,AddToPlaylist
Song zur Rocksteady-Playlist hinzufügen,AddToPlaylist
Funtwo zu disco fever track hinzufügen,AddToPlaylist
Ich würde gerne dieses Album zu meiner Siesta-Playlist hinzufügen.,AddToPlaylist
Kevin Cadogan zur 80er Jahre Classic Hits Liste hinzufügen,AddToPlaylist
den Künstler zu meiner Spooning-Playlist hinzufügen,AddToPlaylist
Fügen Sie diesen Alan Wilson Track zu meiner Is Luis Fonsi Playlist hinzu,AddToPlaylist
Für meine Playlist Wild Country fügen Sie ein great day for freedom,AddToPlaylist
Füge ricky nelson zu meinem klassischen X-Spieler hinzu,AddToPlaylist
track zu meiner Playlist hinzufügen ein sudden rainstorm,AddToPlaylist
Hinzufügen ronnie james dio tune zu Frauen der elektronischen Auswahl,AddToPlaylist
Hinzufügen zu isabellas Club Hits diese Sung,AddToPlaylist
include pat smear auf Gästeliste Engadget,AddToPlaylist
