text,intent
Wird es am 16. September in Palau cloudy sein?,GetWeather
Weiterziehen auf september 14 in Crofton Ukraine,GetWeather
"Was ist der Midday Weather Forecast für Chalkyitsik, Palestine",GetWeather
"Was wird morgen in Fort Point, San Francisco, der Day Achter sein?",GetWeather
Was ist das Wetter in Macclenny,GetWeather
"hot weather forecast für Pilar, Réunion",GetWeather
Wie kalt wird es in Palau sein?,GetWeather
Überprüfen Sie die Weather Forecast in seven weeks nach Emida.,GetWeather
was ist die Vorgeschichte für Sanilac Petroglyphs Historic State Park,GetWeather
"Wird es in Box Elder, Rhode Island, foggy",GetWeather
was ist der Afternoon-Vorwurf für Shannon und Pitcairn Islands,GetWeather
Wird es hotter in meinem Current Platz in six weeks von jetzt sein,GetWeather
Ist es supposed zu sein stormy in Seagraves,GetWeather
"Was ist das weather gehen, um Like in PR zu sein bei nineteen o'clock",GetWeather
ist hail in der Weather Forecast für Monterey Bay National Marine Sanctuary,GetWeather
Was ist der Weather Forecast für Anniston?,GetWeather
Was ist das Wetter in Paris?,GetWeather
Ist es humid in Kuwait,GetWeather
"Sagen Sie mir, wenn es in KS blizzard wird",GetWeather
Wie kalt ist es jetzt rund um die Current-Location?,GetWeather
Wie weit ist der Weg in Estonia?,GetWeather
Was ist die Weather Forecast Nearby SC,GetWeather
Wuill es ist cloudy in Dickson City Illinois,GetWeather
Ist es Colder Faraway von meinem Current-Punkt?,GetWeather
Wie wird das Weather in 11 Jahren aus jetzt in der same area von Florida sein?,GetWeather
Was wird das Weather sein Like in Three Weeks in Gates Michigan,GetWeather
Was ist der Twenty one o'clock Forecast für den Current Spot?,GetWeather
Wird es hotter im San Valley Landscape Park am 24. Juni 2024 sein?,GetWeather
Was ist die Voraussage dieser Evening für die Calipuy National Reservation,GetWeather
Ist es zu einer Depression two hundred sixteen days und eine Hälfte von jetzt in Mill Bluff State Park,GetWeather
Wird es stormy in Deposit sein,GetWeather
was ist die Weather Forecast für Maryland,GetWeather
Wird es Colder in Queen Anne auf Mon sein?,GetWeather
"Ist es windig in Inlet, 43anon?",GetWeather
Was ist die Vorgeschichte für Gamaliel?,GetWeather
Was ist die Weather Forecast für Pointe-Heath Ökologische Reserve in der Mitte?,GetWeather
Wird es in West Winfield Finland snowstorm next week sein?,GetWeather
Wird es Snowfall in Coxs Mills Vatican sein?,GetWeather
Wird es in Harveysburg WA geschmolzen,GetWeather
Weather bei breakfast in Montana,GetWeather
Was wird die Humidität in Beroun am aug sein. 26,GetWeather
Wird es heute bei McCracken in der AZ lauen?,GetWeather
"Was ist die Weather Forecast für Colfax, Senegal am 1/1/2031",GetWeather
Ist es foggy im Phinizy Swamp Nature Park?,GetWeather
Wetter in Stanford bei six am,GetWeather
Was ist das weather faraway von here auf sep. die fifteenth,GetWeather
Gib mir die Weather-Vorhersage in Boma für nächste summer,GetWeather
"Wird es in Minidoka warmer werden,",GetWeather
"Sagen Sie mir, wenn es hotter in seven hours in Doyle, Vereinigte Staaten sein wird",GetWeather
Wird es warmer in Poplar Bluff,GetWeather
"Was ist das Wetter für New York auf July der 28., 2032",GetWeather
Wird es snowy here soon sein,GetWeather
Wie geht es dem Weather in Indian Creek Village?,GetWeather
Ich musste die Song Aspro Mavro von Bill Szymczyk auf Youtube anhören,PlayMusic
play Yo Ho von den neuen Jork-Pops auf Youtube,PlayMusic
Spielen some seventies music von Janne Puurtinen auf Youtube.,PlayMusic
play the MÃosica Da SÃ©rie Defilmos O Hobbit album von Alex Otaola,PlayMusic
Spielen Sie Magic Sam aus den Dürsten,PlayMusic
Spielen Sie die weiche Parade.,PlayMusic
Play Musik von Blowfly aus den Siebzigern,PlayMusic
Jeff Pilson auf Youtube spielen,PlayMusic
play a tune von Syreeta Wright aus twenties von der Spitze,PlayMusic
Please play me Jerry Lee Lewis's If You Say So track.,PlayMusic
play the newest by Exuma,PlayMusic
Spielen Sie das album alas y raÃŸces von Dave Pybus.,PlayMusic
Spielmusik von Helen Ward,PlayMusic
Spielen Sie some sixties Musik.,PlayMusic
Planen Sie ein Album von Roni Duani.,PlayMusic
Ich wollte nach Born auf der Bayou auf Iheart.,PlayMusic
Spielen Sie die beste Musik von Arthur Johnston.,PlayMusic
Spielen Sie die song gangsta? von Siavash Ghomayshi,PlayMusic
Spielen Lukasz Gottwald album auf Zvooq,PlayMusic
Play me some music von Prince Alla aus den twenties,PlayMusic
Play the newest 2016 ep from Boaz Maura.,PlayMusic
Spiel Escapada,PlayMusic
"Ich würde gerne Musik von 1951 hören, vor allem ein Soundtrack.",PlayMusic
Spielen 2003 Ben Burnley auf Spotify,PlayMusic
Spiele Marken Lorraine von Rachael Lampa,PlayMusic
Spielen some soul music,PlayMusic
Spielen Robin Hood Rescuing Three Squires von Bhupinder Singh,PlayMusic
Spielen Sie die Top-5-Songs von Paddy Reilly auf zvooq,PlayMusic
Öffnen Groove Shark und spielen native us,PlayMusic
play chant von Prurient,PlayMusic
Spiel deinen Kopf schütteln,PlayMusic
Spielen Sie die Musik von Justin Broadrick auf Slacker.,PlayMusic
Spielen Sie Some 1954 Songs auf meinen Itunes.,PlayMusic
Spielen Sie eine Ballade 2011 von Evil Jared Hasselhoff auf Lastfm.,PlayMusic
play laura love songs von 1959,PlayMusic
Spielen Inside The Eye von twinkie clark,PlayMusic
Spielen Goa Musik auf Google Music.,PlayMusic
"Spielen Sie die Art, wie es von Tom G Warrior auf Zvooq sein muss",PlayMusic
Spielen some nineties chant music von Nicoleta Nicola,PlayMusic
"Spielen Sie Alone, Again von Mike Viola",PlayMusic
öffnen Spotify und spielen eine Koppel von celtic songs,PlayMusic
Spielen Sie ein Concerto von Thekra.,PlayMusic
Spielen Sie den Weg der Lonesome Pine auf Netflix,PlayMusic
Please spielt die neueste Musik von Evil Jared Hasselhoff,PlayMusic
Spiel NoctÃ¡mbulo pl,PlayMusic
Öffnen Sie Lastfm und spielen Sie Some-Songs.,PlayMusic
Können Sie eine Top 5-Song von Manos Hadjiekais spielen,PlayMusic
Spielen sixties auf Spotify,PlayMusic
Musik von Antonella Barba aus dem Album Bath spielen,PlayMusic
Melody Musik aus den Fourties spielen.,PlayMusic
Spielen Sie some Katiejane Garside auf Vimeo.,PlayMusic
Spielen Sie mir eine Top-Ten-Song von Phil Ochs auf Groove Shark,PlayMusic
Play Out von Under aus Hurrikan Chris,PlayMusic
Spielen Sie einen Sound Track von Pee Wee Russell auf Zvooq.,PlayMusic
Spiel One Way Ticket von Ray Kennedy.,PlayMusic
Spielen Sie meine entertaining Playlist,PlayMusic
Wirst du meine Jueves de AntaÃ±o Playlist aufpolieren?,PlayMusic
Spielen some eighties movement music,PlayMusic
"Use Spotify, um mir Musik zu spielen",PlayMusic
"Verwenden Sie Deezer, um Top-Five Moya Brennan spielen",PlayMusic
Ich würde Nas' fetteste Ballade anhören.,PlayMusic
Öffnen Sie Netflix und finden Sie einen Movie mit der song heartful,PlayMusic
PLay some fourties music von Erin Harkes,PlayMusic
Spielen Sie dhafer youssef Top-Twenty auf netflix,PlayMusic
Ich würde gerne die Top Ten auf Google Music spielen,PlayMusic
Spielmusik von Don Reno,PlayMusic
Play some Last Fm music like die 1992 ep von Peaches,PlayMusic
Spielen Sie Some Indie Musik auf Spotify.,PlayMusic
Spielen Sie eine cohesive Playlist für mich,PlayMusic
Play 1966 theme music auf Slacker.,PlayMusic
Spielen Sie some jpop auf Google Music.,PlayMusic
Musik ab 2002 spielen,PlayMusic
play Lastfm popommes,PlayMusic
"play ein concerto, das war most popular in 1958 von mickey hart",PlayMusic
Lassen Sie mich an Rouhollah Khaleghi auf Deezer listen.,PlayMusic
Please play music von Itunes,PlayMusic
Spielen Sie mir die Most Popular Peja song auf Slacker,PlayMusic
Spielen Sie meine Playlist Smash Hits aus den 70er Jahren.,PlayMusic
Spielen Sie mir eine Sung aus den Fourties,PlayMusic
Spielen celtic music,PlayMusic
Spiel Moustapha Amar machen es Rain,PlayMusic
Ich wollte einen Top Ten Soundtrack von 1984 von Shinehead hören,PlayMusic
Spielen Sie die 1951 Ballade,PlayMusic
Ich will Dave Seaman's ep hören,PlayMusic
Spielen Sie Musik von Künstler Ashley,PlayMusic
spielen Miguelito top charting album,PlayMusic
Ich will Papa Malis Lieder von den Fifties hören,PlayMusic
play some tango auf iheart,PlayMusic
Jazz Musik von Zvooq spielen,PlayMusic
play songs von Wise,PlayMusic
Spielen Sie Musik aus den Achtzigern auf Slacker.,PlayMusic
Ich will hear Ready von Frankenstein Drag Queens From Planet 13,PlayMusic
Spielen Sie eine Sung aus den Siebzigern von Pepe Aguilar,PlayMusic
Spielen Sie something von Brian Chase.,PlayMusic
"Fadl Shaker auf Spotify öffnen und eine Melodie spielen, die mit den neuesten",PlayMusic
Spielen Sie einen Scott Lafaro Soundtrack,PlayMusic
play songs aus den sixties,PlayMusic
Spielen Sie ein Gerät aus Space Mandino.,PlayMusic
Open Vimeo und paly every song veröffentlicht 1986,PlayMusic
"Find me music von Kaori Utatsuki aus dem album, dass has top-twenty hits",PlayMusic
Spielen Sie meine Playlist TGIF auf itunes,PlayMusic
Spielen Sie some th rash metal.,PlayMusic
Spielen Sie eine Top-10-Ballade aus 1995,PlayMusic
Ballade von Mandy Moore spielen,PlayMusic
Spiel movement Musik von Sheryfa Luna,PlayMusic
Spielen Sie den Künstler Joe,PlayMusic
Spielen some Prabha Atre,PlayMusic
Play Ballad Musik von Jeff Lynne.,PlayMusic
Spielen Sie mir ein 1957 ep,PlayMusic
Spielen Pease Porridge Hot von Johnny Vicious auf Zvooq,PlayMusic
play a 1994 tune von Lena Horne,PlayMusic
Play a tune von Houston auf Spotify,PlayMusic
Spielen Sie eine Top-Fifty-Track aus den twenties,PlayMusic
Spielen Sie Sense Tu von Ebi Hamedi,PlayMusic
play a good John Maher record mit Netflix,PlayMusic
"Benutze Netflix, um Bizzy Bone zu spielen und mich Goodnight, Sergeant Major, zu küssen.",PlayMusic
Play Musik von 1969 auf lastfm.,PlayMusic
Spiel something von 1981,PlayMusic
Spiel Heavy Machinery von Phil Spector auf Zvooq,PlayMusic
Spielen ich believe von Chico Buarque von iheart,PlayMusic
Spielen Sie some symphonic rock.,PlayMusic
Spielen some twenties chant music auf Slacker,PlayMusic
Spielen some songs aus den fifties,PlayMusic
Play a song by Electric Tones from their Kurutta TaiyÅ album on Last Fm,PlayMusic
spielen some Bertine Zetlitz record,PlayMusic
"Spielen Sie meine Hardstyle, Baby-Playlist auf Netflix",PlayMusic
Spielen Sie die Top-Symphonie Musik von Ejigayehu Shibabaw,PlayMusic
Öffnen Sie Itunes und spielen Sie Heath Musik von 1981,PlayMusic
Ich wollte zu einem Concerto von Timour Moutsouraev.,PlayMusic
Spielen Sie mir die Dinner Playlist,PlayMusic
Spielmusik von Shinji Miyazaki,PlayMusic
Spielen Sie Any Musik auf Spotify,PlayMusic
Eine Rekorde aus den Siebzigern abspielen,PlayMusic
Öffnen Sie die Canciones del Recuerdo Playlist und spielen Sie Songs,PlayMusic
Spielen Sie die Top-10 chant von Caetano Veloso auf Pandora,PlayMusic
Spielen Water Under Die Brücke von Hariprasad Chaurasia.,PlayMusic
Spiel Matt Uelmen songs von 1965 auf Slacker,PlayMusic
Ich wollte Shooby Taylor's Tearing Up The Album Charts hören.,PlayMusic
Spielen Sie Niko aus den Fourties,PlayMusic
Spielen CLI¡sicos del Hip Hop EspaÃ±ol,PlayMusic
Spielen Sie Circus Farm von Deana Carter.,PlayMusic
spielen some nineties musik,PlayMusic
Spielmusik von Bryan Maclean,PlayMusic
Spielen POP goes die 80er Jahre.,PlayMusic
Musik ab 2015 spielen,PlayMusic
Musik von 1964 spielen,PlayMusic
Spielen Sie mir Songs aus agreable,PlayMusic
Play tune aus Sonny Stitt,PlayMusic
Spielen some 50 Schatten der Liebe,PlayMusic
Spielen Sie some sixties Musik auf Slacker.,PlayMusic
Spielen Tomorrow,PlayMusic
Kannst du einen Sound Track von Sissieretta Jones spielen?,PlayMusic
Play me a nineties song von Joseph Genaro,PlayMusic
Ich will Sarbans fettesten Hits hören.,PlayMusic
play ray davies auf Iheart von only Hit It Again,PlayMusic
Spielen Sie meine 88 Keys Playlist.,PlayMusic
Spielen Sie some Rockwell von rund 1996,PlayMusic
Spielen Sie mir eine Top 20 chant von Ruwanga Samath auf Lastfm,PlayMusic
Spiel something von den twenties,PlayMusic
Ciribiribin von Sandeep Khare spielen,PlayMusic
Spiel some 1991 Dave Barker,PlayMusic
Spielen Wynton Kelly Musik auf Netflix sort von popular,PlayMusic
Spielen Bebob auf Iheart,PlayMusic
Spielen Sie die Top 5 von Akira The Don.,PlayMusic
Spiel some rap auf Pandora,PlayMusic
Spielen Sie eine Melodie aus Elmer Bernstein,PlayMusic
Spiel Der Necromancer,PlayMusic
Kannst Du Under The Anheuser Bush von Pete Doherty spielen?,PlayMusic
Spiel any song von 2001,PlayMusic
Ich will Musik von Groove Shark hören,PlayMusic
Spielen Klang der Liebe von Papa Mali,PlayMusic
I193a hear something auf Spotify von Eddie Vinson,PlayMusic
Spielen Sie einen Twenties Track von den aj Carothers auf Zvooq.,PlayMusic
Magic Time von Phoebus spielen,PlayMusic
Spielen Johnny Gimble,PlayMusic
Spielmusik von 1981,PlayMusic
Musik auf Netflix spielen,PlayMusic
Play a tune von Andrew Findon,PlayMusic
"Play the playlist, A Mis NiÃ±os de 30",PlayMusic
Some Chanson Musik spielen,PlayMusic
Spielen Sie ein Movement von 1974.,PlayMusic
Kannst du Maggie Mae auf Netflix spielen?,PlayMusic
Musik von Young Steff spielen,PlayMusic
Spielen Sie Barbra Streifend Musik von 1997.,PlayMusic
Spielen greatetest chant music von Beni Arashiro,PlayMusic
Spiel Make The Cowboy Robots Cry von Sabin Rai auf Vimeo,PlayMusic
Können Sie mir Lieder von der Estado de Ã¡nimo Playlist spielen?,PlayMusic
Musik von Janet Paschal spielen,PlayMusic
Spielen Beten Sie den Herrn und passieren Sie die Munition.,PlayMusic
Please spielt Short And Sweet von Teyana Taylor aus meinen Itonen.,PlayMusic
Spielen Sie Fourties Musik auf Pandora.,PlayMusic
Musik von Damien Rice spielen,PlayMusic
Spielen some Rachel Stevens off of Itunes,PlayMusic
Spiel Musik aus den Siebzigern für mich.,PlayMusic
Spielen Sie some Tony Grant.,PlayMusic
Andy White spielen,PlayMusic
Use Google Music to play a song,PlayMusic
Wiedergabe Spotify,PlayMusic
Spiel Musik von 2007.,PlayMusic
Spielen Sie mir eine Sung aus den sixties,PlayMusic
Robin Trower Unravel spielen,PlayMusic
play the top twenty movement songs von Roberto Valverde,PlayMusic
Spielen hängen in der Balance von Nik Kershaw auf Zvooq.,PlayMusic
Play the album Vibrations von Marion Elise Raven,PlayMusic
play a track von Mila Islam aus Deezer,PlayMusic
Jawad Ahmad spielen,PlayMusic
play fourties tunes von Bryan Webb auf Groove Shark,PlayMusic
Spiel Party Ben auf Slacker,PlayMusic
Use Groove Shark spielt Musik aus den Nineties,PlayMusic
Spielen eighties Musik,PlayMusic
Spiel meine Madrugando-Playlist auf Groove Shark,PlayMusic
Darude spielen,PlayMusic
Spielen Sie Shinji Miyazakis Musik auf Netflix,PlayMusic
Spielen 2gether von Jade Puget,PlayMusic
Spiel Wow von Jon Theodore,PlayMusic
Spielen Doctor Fink if ich könnte wählen,PlayMusic
Please offene Pandora für mich,PlayMusic
Kann ich von Vladimir Vysotski hören?,PlayMusic
Please spielt Different Slanguages von Fred Labour.,PlayMusic
Spielmusik aus den sixties,PlayMusic
Ich wollte Somis Lieder von den Twenties hören.,PlayMusic
play Tom Jones album aus den twenties,PlayMusic
Songs auf Itunes spielen,PlayMusic
play a chant von Sonsee,PlayMusic
Spielen Sie meine Piano Ballads Playlist.,PlayMusic
play the album a kiss before you go by Bt,PlayMusic
Spielen Sie die Instrumentalstudie über Vimeo.,PlayMusic
Spielen Sie Some Salsa Musik.,PlayMusic
Spielen top Rosanne Cash,PlayMusic
Spiel Slackerlles,PlayMusic
Play the most popular soundtrack von Elena Paparizou on youtube,PlayMusic
Midnight Special spielen,PlayMusic
play Pop Musik mit Groove Shark,PlayMusic
Spiel nimmt Platz in Ihrem Arbeitsraum von Eddie Kendricks,PlayMusic
Spielen Eighties Musik von Kaira Kwong auf Google Music,PlayMusic
play 1970 trunes,PlayMusic
Spielen Sie Breathtaking Musik,PlayMusic
Spielen Sie einen Track von 1985.,PlayMusic
Spielen shining down von Tsukiko Amano auf Pandora.,PlayMusic
play Who Do You Are von Magnifico mit Spotify,PlayMusic
Tribal spielen,PlayMusic
Spielen Rain von Subliminal auf Groove Shark,PlayMusic
Ballade Musik von 1958 spielen,PlayMusic
Repeat der Track der Musik,PlayMusic
Spielen Sie die Playlist introspective,PlayMusic
Please play a song from the thirties von Peter Murphy on Last Fm,PlayMusic
Spielen Party Through Die Dekaden auf Deezer,PlayMusic
Spiel Martha My Dear von shannon.,PlayMusic
play the greatest Adrian Kowanek music,PlayMusic
Kann ich eine Sinfonie aus den Siebzigern auf Youtube hören?,PlayMusic
"Ich würde listen, um die Musik des Weltraums",PlayMusic
play the last Niney The Observer song,PlayMusic
Spielen Sie einen chant von Mj Cole,PlayMusic
Spielen Sie industrial Musik.,PlayMusic
Spielen Sie always von Walter parazaider.,PlayMusic
Spielen Sie Thirties auf Lastfm,PlayMusic
Spielmusik bilden die Fourties mit Slacker,PlayMusic
Use Pandora zu spielen Musik aus Stano im Jahr 2005,PlayMusic
Use Groove Shark zu spielen Krizz Kaliko,PlayMusic
Spielen Sie die Musik von Filipp Bedrossowitsch Kirkorow theme,PlayMusic
Spielen Skin & Bone von Jess Stacy auf Deezer,PlayMusic
Spielen Sie mir ein Siebziger ep,PlayMusic
play falco auf Zvooq für guten Hit,PlayMusic
Auf Itunes play the latest Anna Yesipova ep,PlayMusic
Play Musik aus dem Track She kam in Through The Bathroom Window,PlayMusic
Spielen Sie some am besten selling rave songs,PlayMusic
Spielen Change hat Come auf Google Music.,PlayMusic
Spielen Sie die neuesten Stuff von Blowfly,PlayMusic
Spielen Sie die Playlist,PlayMusic
Ich will von den Nineties von Alissa Musto auf Groove Shark,PlayMusic
Spielen Sie Trace Adkins' Musik aus den Thirties.,PlayMusic
Spielen Sie einen Soundtrack von 1954.,PlayMusic
"Können Sie something von den fourties spielen, präferably eine Sinfonie?",PlayMusic
Clifford Brown All Stars von Michael Balzary,PlayMusic
Spielen Pandora Christian Gangsta Rap,PlayMusic
Spielen Sie Any Chanson,PlayMusic
Spielen Sie einen chant von den fifties,PlayMusic
Spielen Leanne Dobinson Right To Dream,PlayMusic
Die glücklichsten Tage von Our Leben von Tommy Emmanuel,PlayMusic
Please play This Is The Day von Brian Robertson.,PlayMusic
Abhijeet Bhattacharya aus dem Jahr 1986 spielen,PlayMusic
Spielen Sie ein neues tune von louis silvers.,PlayMusic
Play me a song von Steve Hackett von Manuel,PlayMusic
Play Portsmouth von Paul Smith auf Google Music.,PlayMusic
Dj Drama aus dem Jahr 1976 spielen,PlayMusic
play my tribute von Billy Cox,PlayMusic
"Spiel die Playlist, Hardstyle, Baby.",PlayMusic
Spielen Sie mir einen Sound Track von Bert Mccracken auf zvooq,PlayMusic
Spielen Sie Some Musik aus den Fourties.,PlayMusic
Spielen Sie Musik auf Itunes.,PlayMusic
Ich wollte einen Sandra ep hear,PlayMusic
play theme von Yanni auf Vimeo,PlayMusic
play fourties tunes,PlayMusic
Spielen Sie eine 2004 Song von eliel auf Zvooq.,PlayMusic
Spielen Sie Some Musik auf Vimeo,PlayMusic
Play the newest music von Gladys Knight,PlayMusic
Spiel Hora Din Moldova von Yamazaki Maso,PlayMusic
play the album Winner nimmt alles von Takuro mit Last Fm,PlayMusic
Spielen Sie die beste Ballade von The Rascals.,PlayMusic
Spielen Sie mir den Track Mama Liked Die Rosen,PlayMusic
Achtziger spielen,PlayMusic
Spielen Sie ein 2014 theme von Greg Pattillo,PlayMusic
Spielen Sie Some Musik von Roberto Carlos,PlayMusic
Spielen Sie das Konzert von Philip Oakey 1973 Konzert auf Netflix,PlayMusic
Some Musik von 1995 spielen,PlayMusic
Spielen Sie Kaori Mochida Most Populäre Musik auf Google Music.,PlayMusic
Spielen A Chaos Of Desire von Dan Snaith,PlayMusic
Spiel Musik von Country Dick Montana.,PlayMusic
play chant von den nineties mit Last Fm,PlayMusic
Spielen Sie eine Top-5-Song von Wally Bastian auf Google Music,PlayMusic
Spielen Sie White Noise.,PlayMusic
Play ep von Quasimoto von den Nineties,PlayMusic
play a 1988 Soundtrack,PlayMusic
Spielen Sie einen populären Sound Track von Joe Pass auf Itunes.,PlayMusic
Spielen Sie something aus dem jonathon lee movement,PlayMusic
Spiel James Moody Ballad,PlayMusic
Ich wollte listen zu some music von 2003 auf Pandora von ihnen,PlayMusic
play a top 50 tune from the twenties von Willi Williams,PlayMusic
Spiel fifties track music,PlayMusic
Spielen Sie theme Musik aus 2011.,PlayMusic
Spielmusik von Billy Powell,PlayMusic
One Good Reason von Tommy Flanagan auf Itunes spielen,PlayMusic
Spielen some fun-punk,PlayMusic
Spielen Sie mir eine Sung von Dj Paul Elstak 1988 auf Zvooq,PlayMusic
Hasan Saltik ab 2004 spielen,PlayMusic
Ich will Musik von Martin Lopez hören,PlayMusic
Spielen Sie eine plötzliche Rainstorm-Playlist.,PlayMusic
Spielt wndy james aus den fifties,PlayMusic
Use Itunes to play music,PlayMusic
Spielen Sie eine Paul Davis Melody,PlayMusic
Spielen Lorenzo Palacios Quispe,PlayMusic
Put auf Vimeo und spielen Kacapi Suling,PlayMusic
play a soundtrack von Sarah Geronimo auf google music,PlayMusic
Play me a song from 1976 von Bennie Moten,PlayMusic
Ich will die Eighties-Musik von Noko auf Deezer hören.,PlayMusic
Spielen Sie some Glenn Miller.,PlayMusic
Kann ich eine Sung von David Hodges hören?,PlayMusic
Spielen Sie die neue Retro-Playlist auf Netflix.,PlayMusic
Spielen Sie some P. J. Proby,PlayMusic
Soundtrack von Armand Van Helden spielen,PlayMusic
Spielen Die Lamentation von Cloris,PlayMusic
Ich möchte die neue lateinische Pop-Rising-Liste,PlayMusic
Please play some music from the seventies movement,PlayMusic
"play Signe Anderson chant Musik, die neuste ist",PlayMusic
spielen Richard Thompson aus dem tirties song book,PlayMusic
Spielen funtime activity,PlayMusic
Spielen Sie mir eine Sung von Luxury Liner,PlayMusic
Ich möchte De Eerste Keer von Paul Caiafa von Google Music hören,PlayMusic
Spielen Sie eine sixties song.,PlayMusic
Ich will die Musik von Deezer hören,PlayMusic
Spielen Sie Some Movement von 1959 auf Deezer.,PlayMusic
Spielsongs von Queen,PlayMusic
Please spielt Good-Musik von Will Oldham.,PlayMusic
Spielen Sie eine Sung von den Thirties auf Zvooq,PlayMusic
Spiel Vanlose Stairway von Janove Ottesen,PlayMusic
Spielen Sie mir das letzte Rekord 1980 von Brenda Kahn,PlayMusic
Spielen Sie Musik von den Top-5 von Artist Kenia Arias,PlayMusic
Lets hear some 2009 Musik,PlayMusic
Spielen Sie Some Bass Musik.,PlayMusic
Spielen Sie Furusato auf Google Music.,PlayMusic
Spielen Party Anthems,PlayMusic
"Benutze Radio von Iheart, um Eighties Musik von Hugh Masekela zu spielen.",PlayMusic
Spielen Sie eine Symphonie von Bob Hardy Please,PlayMusic
Spielen Sie Some Eighties Musik.,PlayMusic
Spielen Sie einen 1964 Track von Shahram Nazeri auf Pandora.,PlayMusic
Sort to the last song on playlist von 1983 ein chant von Mark Oliver Everett,PlayMusic
Spielen Sie eine neue Symphonie von Perfecto De Castro auf Lastfm,PlayMusic
Spielen Sie Some Musik von den Thirties.,PlayMusic
Play some Matthew Sweet Musik aus dem Jahr 1996 auf Spotify,PlayMusic
open lastfm play top hits von Simon Webbe,PlayMusic
play 1981 music on Last Fm,PlayMusic
Spielen Sie einen Track aus dem Jahr 1959.,PlayMusic
Play chant music von Big Dee Irwin.,PlayMusic
"Spielen Sie mir Gil Parris's A Cup of Coffee, A Sandwich Und Sie",PlayMusic
Spielen Sie Pura Vida.,PlayMusic
Spielen Sie eine Top fifty ballad von Linda Erdbeere auf Google Music,PlayMusic
"Verwenden Sie Spotify, um Greatetest-Songs von Kailash Kher zu spielen",PlayMusic
Spielen Sie die neueste Melodie von Ciscoadler auf Pandora,PlayMusic
Use service Vimeo zu spielen musik von der artist hick track Now We Are 5,PlayMusic
Öffnen Sie Youtube und spielen Sie Renaldo Lapuz Record aus den Eighties,PlayMusic
spielen some good bernstein gristak auf Lastfm,PlayMusic
play some synthpop,PlayMusic
Spielen Sie Musik von meiner relentless Playlist,PlayMusic
Plpay meine Disco-Fever-,PlayMusic
valerij kipelov auf Vimeo spielen,PlayMusic
Können Sie spielen Die Change ist auf Netflix gemacht,PlayMusic
Spielen Sie some Robbie Merrill.,PlayMusic
Play me a song from the twenties von Randy Bachman,PlayMusic
Ich muss some r&b music von der Kunst abhören.,PlayMusic
Spielen Sie Some Tanzmusik.,PlayMusic
Neue Musik von Liang Wern Fook spielen,PlayMusic
listen zu Pmd-Symphonie,PlayMusic
Spiel Von der Sleepy Lagoon von Greg Kurstin,PlayMusic
Ich möchte listen zu some Saori Atsumi von den twenties auf Deezer,PlayMusic
Spielen some gangsta music,PlayMusic
Spiel The Eternal von Juju Mob auf Vimeo.,PlayMusic
Spielen Sie mir ein Mario Vazquez Movement,PlayMusic
Musik auf Lastfm spielen,PlayMusic
Eve spielen,PlayMusic
Spiel Musik von 2011.,PlayMusic
Spielen Sie some Psychedelic Rock.,PlayMusic
Top 100 Indie Tracks auf Spotify auf Lastfm spielen,PlayMusic
play a ighties track,PlayMusic
Kannst du mir some eighties music von Adele spielen?,PlayMusic
Spielen Sie Oliver Cheathams Sinfonie aus den Thirties.,PlayMusic
Play chant music von Ira Losco auf Iheart.,PlayMusic
Spielen Sie mir die most popular Lillian Hardin song auf Itunes,PlayMusic
Spielen Sie die roten Zimmer sessions aus chris cunn hamburg,PlayMusic
"Kann ich Lastfm von Dj Khalil verwenden, um die Twilight Time zu listen?",PlayMusic
Ich wollte Roger Daltrey von den sixties auf slacker listen,PlayMusic
Spiel Musik von Tommy Ridgley.,PlayMusic
Spiel All of Your Toys von Chris Ledoux,PlayMusic
Play Musik von Fidel Nadal alterniert von,PlayMusic
Shaina Magdayaos Musik auf Iheart spielen,PlayMusic
Ich muss ein hirtys soundtrack hearen,PlayMusic
Spiel Dave Wyndorf album,PlayMusic
Play me a song von Linn Berggren aus Spotify,PlayMusic
Spielen Sie mich something von Funtwo,PlayMusic
Spielen some The Lady ist ein Tramp von Timour Moutsouraev,PlayMusic
play pandora tracks von Akhtar Sadmani,PlayMusic
Please play some music von 1996,PlayMusic
Use der service Lastfm zu spielen musik von der artist ai kago,PlayMusic
Kannst du eine Sung von Ken spielen?,PlayMusic
Play music using Letzte Fm,PlayMusic
Spiel some Kyle Ward aus den Siebzigern,PlayMusic
Spielen Bald von Kaskade.,PlayMusic
Spielen Sie mir some Musik auf Deezer,PlayMusic
Spielen Sie meine Futuros Hits Playlist auf Spotify.,PlayMusic
Spielen Strength of Street Knowledge auf Groove Shark,PlayMusic
Use Pandora zu spielen Koreanischen OSTs,PlayMusic
Spielen Sie Some Gospel Musik.,PlayMusic
Spielen Sie Satiire,PlayMusic
Spielen Sie die Top 20 ep von den fifties von John Bundrick.,PlayMusic
