text,intent
Bringen Sie mich zum Top-rated Taverna in Sealy forfettoria next week for 5,BookRestaurant
"Ich brauche eine ution für mich, Edna und alyson im steakhouse called smoking room",BookRestaurant
"susanne und carey phillips wollen zu einem brasserie nicht weit von Pricedale, dass serves southern brazilian",BookRestaurant
Ich wollte einen Tisch für meinen Grandson und ich somewhere in Arkansas,BookRestaurant
Ich wollte einen Tisch für 3 bei einem Restaurant,BookRestaurant
"book near Montana restaurant serving sri lankan food für 6, die hoch rationiert ist auf den tus.",BookRestaurant
Ich brauche eine ution für die Oase Drive-In für eine Party von four,BookRestaurant
Ich brauche ein Diner.,BookRestaurant
book a restaurant für four in Trinidad und Tobago,BookRestaurant
Ich wollte einen Puglia Food Court in KY buchen.,BookRestaurant
"Lassen Sie mich, Kirsche und Tracie zu einer Noyack Bar take",BookRestaurant
Buchen Sie eine reservation für eine top-rated lebanese Fast-Food-Platz,BookRestaurant
book aosteria mit smoking Zimmer in Creola,BookRestaurant
Ich brauche einen Tisch für Four in einem Restaurant in AL,BookRestaurant
Ich muss ein Restaurant für seven Leute bei elevenses Seafood restaurant buchen,BookRestaurant
Ich würde gerne einen Tisch bei Black HorseTaern in Georgia um 4 Uhr morgens buchen.,BookRestaurant
Buch Tartine in Mississippi für 5,BookRestaurant
Ich würde gerne im besten Restaurant essen,BookRestaurant
Buchen Sie einen Tisch für zehn für Breakfast in Minnesota.,BookRestaurant
Please book a room to accommodate one in 11 weeks near Bahamas restaurant,BookRestaurant
Lets eat bei Newport Creamery in Carnot,BookRestaurant
Ich brauche ein reservation für four in a restaurant in 1 hour und 1 second,BookRestaurant
book any popular puglia serving oyster bar für 10 in Jemez Springs,BookRestaurant
Buchen Sie einen Tisch in der South Street Diner Close zum College Ihres Teenagers.,BookRestaurant
Ich möchte ein Restaurant in Keeling Islands für eine Party von zehn,BookRestaurant
Ich brauche eine Ritonavir für eine Chrurrascaria in Oneonta Wyoming für eine Party von 4,BookRestaurant
Buchen Sie einen Platz für 7 Personen an einem Lebensmittelplatz in Denmark,BookRestaurant
Buchen Sie ein Restaurant in Almyra in 10 Jahren,BookRestaurant
"Findet eine Beschwörung mit dem Walking Distance von pauline Platz für eine Party von 10 bei fourteen o'clock in einem Restaurant, das aioli serves",BookRestaurant
Können Sie eine Ritonavir für das nächste Jahr in Modesto für Joanna und ella,BookRestaurant
"Want a table at Montys Hotel, Secunderabad im Bundesstaat Vermont",BookRestaurant
"Ich wollte für Masonville, Vermont nov. 7",BookRestaurant
Buchen Sie ein Socca-Sserving-Steakhouse für 2 in Saint James Alabama,BookRestaurant
Buchen Sie einen Tisch für Ninine in Svalbard und Jan Mayen.,BookRestaurant
"Ich muss einen Tisch für 4 bei einem brasserie finden, dass has fondue",BookRestaurant
"Ich brauche ein Restaurant, das 3 in Cochran seat, das wifi hat.",BookRestaurant
Ich brauche einen Tisch für 10 im besten Gastropub,BookRestaurant
"Machen Sie mir einen Hinweis, dass serves kebab in einem delicatessen in AMbler",BookRestaurant
Buchen Sie einen Tisch in einem french restaurant für fern und ich,BookRestaurant
Ich brauche eine ution für ein hochkarätiges Bistro für eine Party von 10 Jahren.,BookRestaurant
"Ich möchte eine pub im Juniper für 8 buchen, die Bûche de noël",BookRestaurant
buche ein restaurant für meine Schwester und ich,BookRestaurant
book a pub in Clermont für 8 Personen,BookRestaurant
"Buchbesichtigungen bei restaurant in Edgemoor NM auf august 3, 2024",BookRestaurant
Ich wollte ein Restaurant für two in 42 weeks von jetzt in Wagram buchen,BookRestaurant
"Buchen Sie ein Restaurant in Everson Nevada, das conchiglie für two Menschen dient.",BookRestaurant
Please book a restaurant für zehn members near downtown um 20:38 Uhr,BookRestaurant
"Buchen Sie einen Tisch für 6 in The Cheese Course, Blocher am 10. Februar.",BookRestaurant
"Buchen Sie einen Tisch für mich, naomi und elisabeth auf einem brasserie mit wifi",BookRestaurant
ein Tisch an einem hoch gereiften south tyrolean joint,BookRestaurant
"Machen Sie mich zu einer Party mit 6 Personen in einem pub bei five o'clock in Arizona, die Waffeln in der Stadt Hat Creek serviert",BookRestaurant
restaurant skandinavian in Grenada,BookRestaurant
Kann ich some russische Cuisine in einem Restaurant mit Shari und mir bekommen?,BookRestaurant
"Können Sie mir einen Tisch reserved für Three hundred thirty three Days aus jetzt für ight Menschen an einem hoch gereiften Fast Food Platz, der nordischen Indien Essen nicht distant aus Moores Mill serviert",BookRestaurant
"Buchen Sie eine Osteria, die serves blini für 9 Personen.",BookRestaurant
Please book a brasserie restaurant for ight in Irland,BookRestaurant
book a table for 2 in Gleed,BookRestaurant
"Buchen Sie bei einem Restaurant, das serves brazilian Essen für 9 Personen",BookRestaurant
Buchen Sie ein Restaurant im Freien.,BookRestaurant
book verdure serving restaurant in Bloom City,BookRestaurant
book a restaurant in AL bei Oak Ridge,BookRestaurant
Ich will die Ninine zu einem Diner close zum Spa schleppen.,BookRestaurant
book a spot at a highly rated afghan restaurant,BookRestaurant
Buchen Sie eine Personalberatung für Thomas Hynes Haus auf jan. die Third in Netherlands,BookRestaurant
"Buchen Sie eine Erklärung für Leticia, Melva und twila edwards an der Glassy Junction für five pm mit der same area unserer secondary residence",BookRestaurant
Ich möchte um 1 Uhr einen Food Court für 5 Uhr buchen.,BookRestaurant
Find a reservation at Berowra Waters Inn in Australien in 2 Jahren,BookRestaurant
buche einen Tisch in Fullerville an einer hochkarätigen Bar,BookRestaurant
Könnt ihr euch für mein Faather und mich in einem Restaurant in Birch Run besänftigen?,BookRestaurant
Buchen Sie ein bestes Restaurant in Wrigley.,BookRestaurant
"Ich brauche einen Tisch für 8 Personen in einem hoch rationierten pub, dass dient Umbrian Cuisine",BookRestaurant
Ich würde für zehn seats bei einer hochkarätigen brasserie in Kirgisistan like,BookRestaurant
Buchen Sie ein restaurant mit parking für three Menschen.,BookRestaurant
"Buchen Sie einen Tisch für 2 im Mustard Seed, Achat.",BookRestaurant
Buchen Sie mir eine Bar where Ich kann eine Bear Claw in AS bekommen,BookRestaurant
Findet mir einen Tisch für mich und meinen grandkid im Union Square Cafe,BookRestaurant
stacy watson und adriana won to go to the bestosteria in Hallowell Minnesota diese afternoon,BookRestaurant
Ich würde am Old Dutch in 15 seconds in Northern Mariana Islands essen,BookRestaurant
buche einen Tisch an einer Pool-Bar,BookRestaurant
"Ich wollte Louisiana Fried Chicken in McColl, IA essen.",BookRestaurant
buchen Sie einen Tisch in Tennessee für 1 für nächsten August,BookRestaurant
"Ich würde gerne in der Austern-Bar essen für eine Party von one, die has internet",BookRestaurant
Ich wollte einen Tisch für Jacqueline Wilson und Deanna im David Carpenter House in Uncas FM,BookRestaurant
Buchen Sie ein restaurant für one Person um 7 Uhr,BookRestaurant
"Buch eine brasserie, die mezzes in Iowa serviert.",BookRestaurant
Would like book a restaurant der letzte Day von sukkot für lee und ines,BookRestaurant
Buch Red Crown Tourist Court jetzt für zehn nicht weit von Tin City,BookRestaurant
"Ich wollte ein Kafe finden, das in Tunisia Meat Close serviert und von jetzt an einen Tisch für 2 One second benötigt.",BookRestaurant
um 4 Uhr buchen Sie eine Bar in der spa in Shamrock für ight,BookRestaurant
Buchen Sie einen Tisch an einem Indoor restaurant now.,BookRestaurant
Ich wollte einen Tisch für 8 in Plain am 5. August.,BookRestaurant
Buchen Sie ein hochkarätiges Coffeehouse für unsere Leute.,BookRestaurant
Ich möchte auf einem Lesotho Platz Supper essen.,BookRestaurant
Restaurant in Durant für 15 Uhr,BookRestaurant
"Lets go to the Rainforest Cafe, das in der same area als 135. St ist",BookRestaurant
Ich würde eine Bar mit hawaiischem Essen in ND liken,BookRestaurant
"Buchen Sie einen Tisch für 1 November der first, 2022",BookRestaurant
Könnt ihr mich für eine Party von 5 gewinnen?,BookRestaurant
Buchen Sie ein populäres Restaurant in New Jersey.,BookRestaurant
"Buchen Sie eine Bar, die bei Robinson chicken french serviert wird.",BookRestaurant
Finden Sie mir eine kreolische restaurant,BookRestaurant
Ich würde gerne bei einem Top-Restaurant in Arkansas einen Ausflug machen.,BookRestaurant
"Ich möchte ein Bistro buchen, das pasta salad in Brazil serviert.",BookRestaurant
"Machen Sie mir eine ution somewhere Außentür in Port Wentworth für eine Party von Five in einem Koffeehaus in zehn Months, die distant ist",BookRestaurant
Buchen Sie einen Platz in einem Steakhouse mit internet,BookRestaurant
Buchen Sie einen Tisch für Chrie und Josephin in Indonesien,BookRestaurant
buche einen Punkt im Top-Rated-Pub in Garner,BookRestaurant
Buchen Sie einen Tisch auf einem Faraway brasserie in NJ.,BookRestaurant
book a table in Griechenland für 4,BookRestaurant
"Ich muss einen Tisch an einem Fast-Food-Spot buchen, der Slinger im PR",BookRestaurant
"book ein spot für one an einem pub, das serves som  Tam",BookRestaurant
"Buchen Sie ein distant restaurant, das serves blini auf 103. St für 6 Personen.",BookRestaurant
"casey chavez, lucinda und karina want zu essen in einem Diner auf decembber der 7.",BookRestaurant
Buchen Sie ein Restaurant für 9 Personen.,BookRestaurant
buche einen Tisch bei Serendipity 3 in Veyo für jetzt,BookRestaurant
Buchen Sie ein bestes Steakhouse für 2 in Montserrat auf 79 Days und eine Hälfte von jetzt,BookRestaurant
buchen Sie am Freitag eine Bar für 2 in Hayden Row,BookRestaurant
Ich möchte die beste pub für 6 in New Mexico buchen,BookRestaurant
"bar restaurant für November das twelfth, 2030 das ist beliebt und für eine Party von zehn",BookRestaurant
book a pizza serving tavern für mich und meine brother,BookRestaurant
Ich würde gerne einen Tisch in Northcote haben.,BookRestaurant
"Please book a restaurant for six members on Jul. 13, 2036",BookRestaurant
Buchen Sie ein restaurant mit einem spa in Connecticut,BookRestaurant
buch ein spot für elise und alma bei einem brasserie in Ravensdale MH für diese week,BookRestaurant
"book a spot for five at a brasserie on jan. 7, 2023",BookRestaurant
Buchen Sie eine Bar mit Pool in Mountain Iron.,BookRestaurant
buchen Sie einen Tisch mit wifi in Delaware bei einem restaurant in one minute,BookRestaurant
Ich muss ein hochkarätiges Restaurant in Coronado buchen,BookRestaurant
Machen Sie mir einen Ausflug in Cedarburg um 0 pm,BookRestaurant
Buchen Sie einen Ausflug für ein Trentino restaurant in Kansas,BookRestaurant
book mich und meine grandparents a restaurant in Saint Helens South Dakota,BookRestaurant
"Reservieren Sie einen Tisch für Teresa und elnora bei einem Fast Food-Joint, der Fisch und Chips",BookRestaurant
Ich möchte ein Restaurant für eine Party von 8 Jahren in einem Vegetarian-Tea-Haus.,BookRestaurant
Ich brauche für dieses Jahr in einem Restaurant eine Personalberatung.,BookRestaurant
book a table in Fairview neighboring the area,BookRestaurant
Need a jüdisch in Maine book a restaurant,BookRestaurant
book spot an einer Balinese,BookRestaurant
Ich wollte ein Restaurant in Idaho für 2 von uns.,BookRestaurant
Buchen Sie ein Tyrolean Restaurant in Crocker Indiana jetzt für 3 Personen.,BookRestaurant
"Kann ich ein Restaurant buchen, das pastelaria in Takilma, Virgin Islands, serviert?",BookRestaurant
Ich wollte eine Tür-Brasserie mit ins Wanken geratener Distance in mir buchen.,BookRestaurant
"Ich möchte mit Angelita, Susan Reed und ashlee watson after us parking ins Postfach gehen.",BookRestaurant
Buchen Sie ein Restaurant in Gate City für 5 Personen.,BookRestaurant
book a spot for six at a restaurant that serves fish and chips,BookRestaurant
buchen Sie einen Platz für 9 beim Dinner in the Sky in SC,BookRestaurant
Buchen Sie eine Taverna in Äquatorialguinea diese Month für Ni,BookRestaurant
Buch ein stracciatella provider coffeehouse für 10,BookRestaurant
Buchen Sie zur Zeit in einem Faraway restaurant in Newtown,BookRestaurant
reserve ein spotat der food truck twelve weeks aus now,BookRestaurant
Buchen Sie in sechs Jahren ein Restaurant in Palau,BookRestaurant
restaurant in West Virginia für meine son und ich,BookRestaurant
"Ich würde gerne einen Tisch an einem Posttisch reservieren, der Andouillettes mit der Omni-Arena in San Marino serviert.",BookRestaurant
"Buchen Sie mir einen Reestaurant, der close in der Cocos Islands Cocos Islands ist.",BookRestaurant
Ich brauche einen Tisch für 10 im Thomas Hynes House nineteen Minuten von jetzt,BookRestaurant
"Please find a restaurant in Sierraville Wyoming, die Platz für 6",BookRestaurant
Braucht einen Tisch für Sep. first in Haiti für eine Party von Three,BookRestaurant
Table für Five in einem Restaurant in Lavina,BookRestaurant
book mir ein taverna restaurant,BookRestaurant
Ich möchte das beste Steakhouse mit South American Cuisines in Alaska buchen,BookRestaurant
Find a reservation for mar. 20th in Winnie at any restaurant,BookRestaurant
Buchen Sie einen Food-Truck in MP für mich und meine Ex-Josband.,BookRestaurant
Ich brauche einen Tisch für 3 im David Whitney House in Brazil,BookRestaurant
book a table for 2 guests at a restaurant in Lazy Mountain NY,BookRestaurant
Eine Tabelle Close von in der Downtown finden area für sherri und ich,BookRestaurant
sofia phillips und winifred walker want to dine bei einem mughlai restaurant in LA am 1. November,BookRestaurant
Können Sie einen Tisch für ight Menschen in einem spa type restaurant mit in walking distance des Metropolitan Borough von Lambeth buchen,BookRestaurant
"buche einen Ort für mich und meine Schwester in einer restaurant, die chas clafoutis",BookRestaurant
make a table reservation at the top-rated brasserie in Cotton Center,BookRestaurant
restaurant im Südsudan für 6,BookRestaurant
Buchen Sie eine Party für 7 auf einem Foodplatz mit Kartoffelsalat in Alabama in eleven hours,BookRestaurant
in 1 second Ich brauche ein Restaurant in San Marino für 9,BookRestaurant
"Ich will einen Gastropub, der einen Spa hat.",BookRestaurant
book a spot at the best steakhouse in Florida,BookRestaurant
Find a reservation at a restaurant that serves gougère in Laneville mit einer Party von Nine,BookRestaurant
book a restaurant für six in MP,BookRestaurant
buchen Sie einen Tisch in Glennie für 1 in den nördlichen Mariana-Inseln,BookRestaurant
Ich will einen Tisch für zwei in einem Restaurant in der Nacht.,BookRestaurant
"restaurant in Elberta für alma, deana und olga um 18:49:20, die serves tsipouro",BookRestaurant
"Ich würde einen Tisch für zehn in 2 Minuten am Französisch Horn, Sonning Eye",BookRestaurant
Buch close-by für 1 in South Dakota,BookRestaurant
Buchen Sie einen Tisch für Chasity Ruiz und Mary in The Fat Duck in Puerto Rico,BookRestaurant
"Ich wollte ein Restaurant buchen, das Lincoln Beach",BookRestaurant
Buchen Sie einen Punkt für One bei einem Fisch restaurant,BookRestaurant
Lassen Sie uns jetzt Somewhere in Roach,BookRestaurant
meine colleagues und ich wuuld like a restaurant in Snow Lake,BookRestaurant
"book tea im Hamburger Wagon für 3 vickie reed, melody und ich in Georgien",BookRestaurant
book a cafeteria für 5 in Turkmenistan,BookRestaurant
Ich möchte zu Bowlegs seven years von now,BookRestaurant
book a spot for seven at a brasserie with ginestrata,BookRestaurant
"Ich würde gerne an einer Bar essen, die mit einer Party von Five corn relish serviert.",BookRestaurant
Können Sie mich für 5 Personen 1 Minute von jetzt in Tuvalu,BookRestaurant
Buchen Sie mir eine ution für 6 bei einem hoch rationierten pub,BookRestaurant
Ich wollte einen Tisch für 7 bei einer populären Kafeterie am Holy Saturday in GA,BookRestaurant
Finden Sie eine Ritonavir für Three in Ansonia MI,BookRestaurant
buchen Sie einen Tisch im Hotel Irma in Mount Repose,BookRestaurant
"Ich würde gerne seats for one in einem Restaurant in 1 Stunde an einem Ort in La Madera, die has parking",BookRestaurant
book a brasserie with a pool within the same area as my neighborhood for 5 people at 19:26,BookRestaurant
Buchen Sie eine Joint Restaurant für four mit einer Außentür area mit in der same area als Borough de Denali,BookRestaurant
Find a reservation at BooneTaern für 4 Personen in 10:24,BookRestaurant
book a restaurant für 27. Juli,BookRestaurant
book a restaurant auf martin luther king jr. day mit parking,BookRestaurant
"Ich will Main Deli Steak House sein, near Hendley.",BookRestaurant
Ich brauche eine ution für 3 hours aus jetzt mit einer party von nine in neighboring Schweden,BookRestaurant
"Lust, im Meatball-Shop zu essen, der mit dem Schwächen des Erica-Campus zusammenhängt",BookRestaurant
buch ein spot für five in der same area als 72. St,BookRestaurant
Finden Sie mir einen Tisch in einer europäischen Bar für sechs in der Nähe von Downtown area,BookRestaurant
Ich würde gerne Salate in einem Restaurant essen.,BookRestaurant
"Buchen Sie einen Tisch für 3 Personen an der Spitze der Restaurants in Washington, D.C. in Riverview",BookRestaurant
book a spot for one at four AM,BookRestaurant
Buch eine close von brasserie in NC.,BookRestaurant
book a meal for four in DC,BookRestaurant
Das Buch ist nicht weit von unserer Nachbarhood für eine Party von 2,BookRestaurant
"Please book a coffeehouse restaurant type room to accommodate griert, trisha und amber which serves pastelaria dish",BookRestaurant
"Buchen Sie eine Bar für six auf July eighth, 2023 in der same area in Äquatorialguinea which serves rillettes.",BookRestaurant
Findet mir einen Tisch für four somewhere,BookRestaurant
Buch Mars 2112 in Rwanda für 4 Personen.,BookRestaurant
"Buchen Sie ein Restaurant, das pasta für 5 Personen serviert.",BookRestaurant
Buchen Sie ein Restaurant für 3 Personen bei eighteen oclock in Saint Vincent und den Grenadines.,BookRestaurant
Ich möchte in einem Escondida South Carolina Restaurant für 8 Personen essen,BookRestaurant
buche einen Tisch für zehn Downtown bei einem close-by restaurant,BookRestaurant
Buchen Sie ein Restaurant für 3 in New Mexico.,BookRestaurant
Ich brauche eine Post mit einem smoking Zimmer in Ucolo reserved.,BookRestaurant
"Ich würde an einem Platz im Iran eine Ritonavir für Neva, Alice und Maggie Parker zaubern.",BookRestaurant
book a restaurant for 4 by shawn's work close by,BookRestaurant
Ich würde gerne an einer Außentür essen restaurant,BookRestaurant
Ich möchte zu 88th St-Boyd Av oder close zu gehen und book seats für 10,BookRestaurant
Kann ich einen Tisch im Fort haben?,BookRestaurant
"Lassen Sie uns diesen Fall bei Any restaurant gehen, die in Finland parking has",BookRestaurant
"buche einen Platz für Gay ramos, Janice gonzales und ich an einer Bar in Timbo",BookRestaurant
"Ich möchte ein Restaurant in der Nähe der Straße buchen, in der ich für Ebenholz und Yolanda lebe.",BookRestaurant
Buchen Sie mir ein Restaurant für Nine in Statham,BookRestaurant
book french food für mich und anline bei a restaurant,BookRestaurant
Ich brauche einen Tisch in one hour von jetzt an in somewhere nicht weit von LA,BookRestaurant
"Buch reservations in einem Restaurant in Niue für mich, edna und glenda",BookRestaurant
buch ein hochkarätiges place in IN in seven years an a pub,BookRestaurant
book a spot for seven an einer bar mit chicken french,BookRestaurant
"Bitte buche mir ein Restaurant bei First Watch in Douglas, Maine.",BookRestaurant
"buch ein spot an einem pub, die trottole für sie meal",BookRestaurant
Ich wollte in Luray nach Dine gehen.,BookRestaurant
Buch in Bolivia ein brasserie für tourte food,BookRestaurant
Ich würde gerne essen in einem neighboring downtown restaurant mit einer Party von 2,BookRestaurant
book Bridge Round House for one at meal time in Democratic Republic of the Congo close,BookRestaurant
book a restaurant für tortelloni für ight,BookRestaurant
"Ich wünschte, ich buche Thomas Hynes Haus für 6 in Minnesota",BookRestaurant
Buchen Sie einen Tisch für meine granddaughter und ich im Restaurant.,BookRestaurant
Buchen Sie eine restaurant reservation in Hongkong,BookRestaurant
Suchen Sie eine Außentür Facility für midday in Datil an einem pub für six,BookRestaurant
Buchen Sie einen Tisch für 10 bei Top Pot Doughnuts,BookRestaurant
buche einen Tisch für chasity und ich in Vanuatu,BookRestaurant
"Please book seating for one person at an indoor restaurant that serves breakfast in Nicholasville, Tennessee",BookRestaurant
"Ich würde gerne in eine Pizzeria gehen, in der ich Hutchinson verdirbt.",BookRestaurant
"Besorgen Sie mir die Scriptions für seven in einem Restaurant in PW, das tourte serviert.",BookRestaurant
"Buchen Sie ein Restaurant in Fort Gates, FL",BookRestaurant
"Ich würde gerne ins venetianische Theater in Gabun gehen, eine Party von Seven.",BookRestaurant
"Buchen Sie mir ein Restaurant, das serves festoni für ight in New Hampshire",BookRestaurant
buchen Sie einen Platz auf einem Foodplatz in Riddlesburg,BookRestaurant
Buchen Sie eine Party mit 4 Personen auf dem Dachboden von Eddie,BookRestaurant
Findet mir ein Eisrestaurant in Mulvane.,BookRestaurant
"Mein great grandfather und ich wollten like, um an einem Taverna vorbeizukommen.",BookRestaurant
"buche einen Tisch in Mississippi am Mai nineteenth, 2034 für mich, silvia und sandy",BookRestaurant
"In Eight Seconds würde ich auf einem Food-Gelände sitzen, das sardinisches Essen in Pidcoke serviert.",BookRestaurant
Ich möchte ein Restaurant für zehn dieser summer buchen,BookRestaurant
"Buchen Sie eine reservation for one an einem italian taverna für two PM in Hutchings, North Dakota",BookRestaurant
book a churrascaria in Macao am Mai die twenty-third,BookRestaurant
Buch eine Beschwerdeführer für ein pub serving gateau in MS,BookRestaurant
Buchen Sie eine ution für six für eine tyroleanische Austernbar,BookRestaurant
Buchen Sie mir eine Reise für Fatty Crew in 13 Wochen in Haskell,BookRestaurant
Machen Sie mir eine Ritonavir in einem Fast Food Restaurant für Elba und Corina in einem Restaurant mit Parking,BookRestaurant
Buch Itsu für Tonight,BookRestaurant
Buch Das Kegs Drive-In in 37 Wochen in Saudi Arabia,BookRestaurant
Ich würde einen Tisch in einem Top-Tea House mit Javanese Cuisine dieses Week in Deutschland lieben.,BookRestaurant
book a restaurant für mich und mein mother in law in Montserrat,BookRestaurant
Buchen Sie mir einen Tisch in einem Top-Tea-Haus in Surinam,BookRestaurant
Ich möchte an einem Ort in der RI nach Four seats suchen.,BookRestaurant
"buche einen Ort für Selma und Molly in einem Steakhouse mit Saucisse, das close-by McSherrystown ist",BookRestaurant
Buchen Sie ein Restaurant in den Maldives in one second.,BookRestaurant
Reservieren Sie mir einen Resturant für 5 bei seventeen o'clock,BookRestaurant
book a tavern on lincoln's birthday/lincoln's day,BookRestaurant
Buchen Sie einen Tisch für Three-Leute bei John Pearson Soda Works in Mauritius.,BookRestaurant
Ich brauche einen Tisch in Neighboring Carencro am Bridge Round House,BookRestaurant
Ich brauche seats für 10 bei einem hoch rationierten restaurant,BookRestaurant
Buchen Sie einen Platz für 9 in dreiunddreißig Three Days im Ringlestone Inn close nach Grenada,BookRestaurant
Ich würde einen Tisch für 10 an einem distant place Downtown für den nächsten Fall,BookRestaurant
Buchen Sie ein Restaurant für acht Menschen in sechs Jahren.,BookRestaurant
Ich würde einen Tisch in einem Taverna mit Croquembouche für 1 Minute von jetzt,BookRestaurant
Reservieren Sie einen Tisch für 8 im nächsten Hitchland.,BookRestaurant
Ich möchte jetzt ein hochkarätiges Fast Food restaurant buchen.,BookRestaurant
Finden Sie einen Tisch somewhere für mich und meine Step Mother in Graniteville DE,BookRestaurant
Please reserve ein Ort im Ballachulish House.,BookRestaurant
Ich wollte eine Kafeterie vor der Tür für 3,BookRestaurant
"buchen Sie einen Tisch für zehn Personen in einem Restaurant, das serves noodle",BookRestaurant
Buchen Sie einen Tisch für eine Party von 7 next year in ID.,BookRestaurant
Buche mir eine Reise bei einem burger joint close-by Choate am 16. Juli 2022,BookRestaurant
Tabelle für two auf November fifteenth,BookRestaurant
book a spot at a restaurant faraway from 138th St,BookRestaurant
Reservieren Sie einen Tisch für 1 Person in WI.,BookRestaurant
Ich wollte am 13. Dezember ein Restaurant für 9 Personen buchen.,BookRestaurant
"Buchen Sie eine Bar für 6, die ham gestuffed und ist nicht too faraway von Canarsie - Rockaway Parkway auf bennington battle Day.",BookRestaurant
buchen Sie einen Platz für zehn in Upper Marlboro PR,BookRestaurant
"Ich wollte einen Tisch in einem delicatessen in Punjabi für mich, anla und vilma buchen.",BookRestaurant
"Besorgen Sie mir einen Tisch für Sonya, Rebekah und ich in einem Restaurant in Latvia.",BookRestaurant
buchen Sie einen Tisch für 3 weit von Tullytown in einem Coffeehouse mit einem smoking Zimmer,BookRestaurant
"Buchen Sie eine Personalberatung für ein Restaurant in Stonewood, GU",BookRestaurant
Ich würde gerne einen runden Ausweis über August den 16. mit einer Party von 8,BookRestaurant
Reservation in Bermuda a food court near jan und ich,BookRestaurant
buch ein spot für 6 in Pilot Mound Palau auf feb. die twenty-fourth,BookRestaurant
bei thirteen o'clock buchen einen Tisch für margie und ich in Vanuatu,BookRestaurant
"Buch TunTaern für shawna davis, mirelle und lizzie in Vermont",BookRestaurant
"Ich wollte eine Restaurantin Perrytown Missouri für Candice, Jeannie und Nichole buchen.",BookRestaurant
buche einen Tisch für Tonight für Rajasthani-,BookRestaurant
buch ein eggo serving brasserie für zehn,BookRestaurant
